Title,Title_URL,textblock23
15 Reasons to Use a Chatbot for Your Real Estate Business,https://botpress.com/blog/15-reasons-to-use-a-chatbot-for-your-real-estate-business,"October 24, 2023"
How to Boost the Customer Experience Using Chatbots,https://botpress.com/blog/how-to-boost-the-customer-experience-using-chatbots,"October 23, 2023"
What is the Importance of the Chatbot Containment Rate?,https://botpress.com/blog/what-is-the-importance-of-the-chatbot-containment-rate,"October 20, 2023"
The 10 Best Customer Retention Strategies for Small Businesses,https://botpress.com/blog/the-10-best-customer-retention-strategies-for-small-businesses,"October 19, 2023"
How to Build Your Own AI Chatbot in 2023: The Ultimate Guide,https://botpress.com/blog/how-to-build-your-own-ai-chatbot,"October 17, 2023"
The Groundbreaking Benefits of Chatbots to Customers,https://botpress.com/blog/chatbot-customer-benefits,"October 16, 2023"
The Best Large Language Models Available Today,https://botpress.com/blog/the-best-large-language-models-available-today,"October 13, 2023"
How to Maximize Small Business Growth with Chatbots,https://botpress.com/blog/how-to-maximize-small-business-growth-with-chatbots,"September 26, 2023"
Ultimate Guide to Artificial Intelligence (AI) and Augmented Reality (AR),https://botpress.com/blog/ultimate-guide-to-artificial-intelligence-ai-and-augmented-reality-ar,"September 23, 2023"
How to Use Facebook Chatbots to Improve Customer Support,https://botpress.com/blog/how-to-use-facebook-chatbots-to-improve-customer-support,"September 19, 2023"
A Comprehensive Guide to Conversational Marketing,https://botpress.com/blog/a-comprehensive-guide-to-conversational-marketing,"September 14, 2023"
From Robot to Human | How to Make Your Chatbot Sound Natural,https://botpress.com/blog/from-robot-to-human-how-to-make-your-chatbot-sound-natural,"September 12, 2023"
How to Develop a Chatbot Strategy,https://botpress.com/blog/how-to-develop-a-chatbot-strategy,"September 6, 2023"
Chatbot vs Live Chat | Which One is Best for Your Business?,https://botpress.com/blog/chatbot-vs-live-chat-which-one-is-best-for-your-business,"September 1, 2023"
How to Make Your Chatbot Provide Accurate Answers,https://botpress.com/blog/accurate-chatbot-answers,"September 15, 2023"
Top Facebook Messenger Chatbots,https://botpress.com/blog/top-facebook-messenger-chatbots,"August 28, 2023"
The Best Slack Chatbots,https://botpress.com/blog/the-best-slack-chatbots,"August 25, 2023"
Top 10 Webchat Chatbots,https://botpress.com/blog/top-10-webchat-chatbots,"August 23, 2023"
Top 5 WhatsApp Chatbots,https://botpress.com/blog/top-5-whatsapp-chatbots,"August 21, 2023"
How to Write Chatbot Scripts | Tips for Success,https://botpress.com/blog/how-to-write-chatbot-scripts-tips-for-success,"August 17, 2023"
Maximizing Lead Qualification With Chatbots,https://botpress.com/blog/maximizing-lead-qualification-with-chatbots,"August 9, 2023"
How To Expand Your Business's Global Reach With A Multilingual Chatbot,https://botpress.com/blog/how-to-expand-your-businesss-global-reach-with-a-multilingual-chatbot,"August 24, 2023"
What is AI Prompt Chaining?,https://botpress.com/blog/what-is-ai-prompt-chaining,"August 31, 2023"
Can ChatGPT be Used in Customer Service or Support Applications?,https://botpress.com/blog/can-chatgpt-be-used-in-customer-service-or-support-applications,"August 21, 2023"
How is ChatGPT's Performance Compared to Human-Generated Content?,https://botpress.com/blog/how-is-chatgpts-performance-compared-to-human-generated-content,"August 1, 2023"
How Can I Improve ChatGPT's Accuracy or Relevance In Its Responses?,https://botpress.com/blog/how-can-i-improve-chatgpts-accuracy-or-relevance-in-its-responses,"July 19, 2023"
Are There Any Legal or Copyright Concerns When Using ChatGPT-Generated Content?,https://botpress.com/blog/are-there-any-legal-or-copyright-concerns-when-using-chatgpt-generated-content,"July 11, 2023"
How is The Quality of ChatGPT's Responses Evaluated and Improved Over Time?,https://botpress.com/blog/how-is-the-quality-of-chatgpts-responses-evaluated-and-improved-over-time,"June 22, 2023"
Can ChatGPT Be Used for Educational Purposes or Tutoring?,https://botpress.com/blog/can-chatgpt-be-used-for-educational-purposes-or-tutoring,"June 6, 2023"
What Are Some Popular Chatbot Platforms That Utilize ChatGPT?,https://botpress.com/blog/what-are-some-popular-chatbot-platforms-that-utilize-chatgpt,"May 23, 2023"
What Are The Possible Applications of ChatGPT?,https://botpress.com/blog/what-are-the-possible-applications-of-chatgpt,"May 17, 2023"
How Can I Train My Own GPT Model?,https://botpress.com/blog/how-can-i-train-my-own-gpt-model,"May 12, 2023"
How Accurate Is ChatGPT In Providing Information Or Answers?,https://botpress.com/blog/how-accurate-is-chatgpt-in-providing-information-or-answers,"May 1, 2023"
How Does ChatGPT Work?,https://botpress.com/blog/how-does-chatgpt-work,"April 26, 2023"
Can ChatGPT Understand And Respond In Multiple Languages?,https://botpress.com/blog/can-chatgpt-understand-and-respond-in-multiple-languages,"April 18, 2023"
Unlocking the Power of ChatGPT: A Comprehensive Video Series on Building a ChatGPT Recipe Chatbot,https://botpress.com/blog/unlocking-the-power-of-chatgpt-a-comprehensive-video-series-on-building-a-chatgpt-recipe-chatbot,"April 14, 2023"
Can a chatbot speak other languages?,https://botpress.com/blog/can-a-chatbot-speak-other-languages,"April 7, 2023"
How does AI relate to natural language processing?,https://botpress.com/blog/how-does-ai-relate-to-natural-language-processing,"April 4, 2023"
How good is ChatGPT at writing code?,https://botpress.com/blog/how-good-is-chatgpt-at-writing-code,"March 29, 2023"
Does ChatGPT Save Data?,https://botpress.com/blog/does-chatgpt-save-data,"March 27, 2023"
List of languages supported by ChatGPT,https://botpress.com/blog/list-of-languages-supported-by-chatgpt,"March 23, 2023"
Top 10 Telegram Chatbot Builders,https://botpress.com/blog/top-10-telegram-chatbot-builders,"March 17, 2023"
Top Telegram Chatbots,https://botpress.com/blog/top-telegram-chatbots,"March 15, 2023"
14 Tools That Developers Absolutely Need,https://botpress.com/blog/14-tools-that-developers-absolutely-need,"March 13, 2023"
What Is The Best Chatbot On The Market?,https://botpress.com/blog/what-is-the-best-chatbot-on-the-market,"March 5, 2023"
What's The Best Chatbot For Your Business?,https://botpress.com/blog/whats-the-best-chatbot-for-your-business,"March 3, 2023"
Unveiling the new Botpress: a GPT-native bot-building platform,https://botpress.com/blog/unveiling-the-new-botpress-a-gpt-native-bot-building-platform,"March 21, 2023"
Can I Chat With GPT-3?,https://botpress.com/blog/can-i-chat-with-gpt-3,"February 21, 2023"
What Is A GPT Chatbot?,https://botpress.com/blog/what-is-a-gpt-chatbot,"February 21, 2023"
Why Connect Telegram With Your Botpress Chatbot?,https://botpress.com/blog/why-connect-telegram-with-your-botpress-chatbot,"February 21, 2023"
Why Connect Discord With Your Botpress Chatbot?,https://botpress.com/blog/why-connect-discord-with-your-botpress-chatbot,"February 21, 2023"
The Power Of Conversational AI Chatbots,https://botpress.com/blog/the-power-of-conversational-ai-chatbots,"February 17, 2023"
How GPT Will Change The Way We Interact With Chatbots,https://botpress.com/blog/how-gpt-will-change-the-way-we-interact-with-chatbots,"February 15, 2023"
9 Best AI Chatbot Platforms,https://botpress.com/blog/9-best-ai-chatbot-platforms,"January 30, 2023"
ChatGPT Chatbots For Business ,https://botpress.com/blog/chatgpt-chatbots-for-business,"January 27, 2022"
Can You Make Your Own Chatbot?,https://botpress.com/blog/can-you-make-your-own-chatbot,"January 26, 2023"
GPT-3 vs GPT-4 | What’s the difference?,https://botpress.com/blog/gpt-3-vs-gpt-4-whats-the-difference,"January 10, 2023"
An introduction to AI chatbots,https://botpress.com/blog/an-introduction-to-ai-chatbots,"December 8, 2022"
Understanding NLU engine,https://botpress.com/blog/understanding-nlu-engine,"December 8, 2022"
How does natural language understanding NLU work?,https://botpress.com/blog/how-does-natural-language-understanding-nlu-work,"December 8, 2022"
What is RPA in Automation?,https://botpress.com/blog/what-is-rpa-in-automation,"August 11, 2020"
What Are the Best Chatbot Use Cases?,https://botpress.com/blog/what-are-the-best-chatbot-use-cases,"August 11, 2020"
How Are Companies Using Chatbots?,https://botpress.com/blog/how-companies-are-using-chatbots,"August 11, 2020"
How to Use FAQ Chatbots to Improve Your Customer’s Experience,https://botpress.com/blog/faq-automation-tips,"August 11, 2020"
Chatbots in the Gaming Industry,https://botpress.com/blog/chatbots-in-the-gaming-industry,"August 11, 2020"
What is Conversational AI and How Does it Work?,https://botpress.com/blog/all-you-need-to-know-about-conversational-ai-platforms,"August 11, 2020"
Chatbot for Bookings,https://botpress.com/blog/chatbot-for-bookings,"May 27, 2022"
So You Want to Talk to a Robot?,https://botpress.com/blog/so-you-want-to-talk-to-a-robot,"May 22, 2022"
What is a deep neural network? Learn more about deep neural networks and how deep learning works,https://botpress.com/blog/deep-neural-network,"November 23, 2022"
What Chatbot Authors Need to Know About the Natural Language Processing Algorithm,https://botpress.com/blog/what-bot-authors-need-to-know-about-the-natural-language-processing-algorithm,"November 29, 2021"
Turing Test,https://botpress.com/blog/turing-test-2,"December 23, 2021"
What is RCS? What does RCS stand for and how RCS chatbots are changing the world of instant messaging?,https://botpress.com/blog/what-is-rcs,"October 7, 2022"
Web Chat and the Future Online Chat,https://botpress.com/blog/web-chat-and-the-future-online-chat,"September 6, 2022"
Will Robots Take my Job?,https://botpress.com/blog/will-robots-take-my-job,"October 21, 2020"
What Is a Customer Service Chatbot?,https://botpress.com/blog/customer-service-chatbot,"October 7, 2022"
What is a Voice Assistant?,https://botpress.com/blog/voice-assistant,"May 20, 2022"
What Are Good or Bad Use Cases for Chatbots?,https://botpress.com/blog/what-are-good-or-bad-use-cases-for-chatbots,"January 16, 2022"
The Future of Big Data is Small Data,https://botpress.com/blog/the-future-of-big-data-is-small-data,"October 20, 2020"
Speaking the Future Into Existence: Why Voice Is the Next Big Thing in Tech,https://botpress.com/blog/speaking-the-future-into-existence-why-voice-is-the-next-big-thing-in-tech,"December 17, 2021"
Chatbots for Healthcare,https://botpress.com/blog/chatbots-for-healthcare,"November 15, 2021"
The Trend Towards Low Code Chatbot Platforms,https://botpress.com/blog/the-trend-towards-low-code-chatbot-platforms,"March 11, 2022"
Chatbots for Telcos,https://botpress.com/blog/chatbots-for-telcos,"October 20, 2020"
Internal Chatbots,https://botpress.com/blog/internal-chatbots,"May 20, 2022"
13 Best Open Source Chatbot Platforms to Use in 2023,https://botpress.com/blog/open-source-chatbots,"July 14, 2022"
Reality Is a Simulation and You Are a Chatbot,https://botpress.com/blog/reality-is-a-simulation-and-you-are-a-chatbot,"October 21, 2020"
AI Now Is Like Computers in the 80s,https://botpress.com/blog/ai-now-is-like-computers-in-the-80s,"October 21, 2020"
Natural Queries for Chatbots,https://botpress.com/blog/natural-queries-for-chatbots,"October 20, 2020"
Voice for Games,https://botpress.com/blog/voice-for-games,"October 20, 2020"
Chatbots for Hotels,https://botpress.com/blog/chatbots-for-hotels,"October 26, 2021"
The Rise of Audio and a Role for Chatbots,https://botpress.com/blog/the-rise-of-audio-and-a-role-for-chatbots,"July 29, 2021"
Chatbot for Tech Support,https://botpress.com/blog/chatbot-for-tech-support,"March 18, 2022"
Is Your Chatbot UX Ready to Go Mainstream?,https://botpress.com/blog/the-chatbot-ux-goes-mainstream,"December 21, 2021"
Why Use a Chatbot Framework,https://botpress.com/blog/what-professional-chatbot-makers-expect-from-a-chatbot-framework-2,"May 20, 2022"
UI Designers Needed for Chatbots?,https://botpress.com/blog/ui-designers-needed-for-chatbots-2,"November 30, 2021"
What I Wish I Had Known from Start About Developing Chatbots,https://botpress.com/blog/what-i-wish-i-had-known-at-the-start-about-developing-chatbots,"October 21, 2020"
Three Key Advantages of Using a Framework,https://botpress.com/blog/three-key-advantages-of-using-a-framework,"November 15, 2021"
Eight Reasons Your Customers Want Chatbots,https://botpress.com/blog/eight-reasons-you-customers-want-chatbots,"February 18, 2022"
Nine Reasons Why You Should Use Chatbots for Your Business,https://botpress.com/blog/nine-reasons-why-you-should-use-chatbots-for-your-business,"April 8, 2022"
Human in the Loop For Enterprise Chatbots,https://botpress.com/blog/human-in-the-loop-for-enterprise-bots,"October 21, 2020"
Webchat,https://botpress.com/blog/webchat,"September 24, 2021"
Open vs. Proprietary Solutions,https://botpress.com/blog/open-vs-proprietary-solutions,"October 20, 2020"
Why Every Agency Should Be Building Customer Service Chatbots for Their Customers,https://botpress.com/blog/why-every-agency-should-be-building-customer-service-bots-for-their-customers,"October 21, 2020"
Exploring the Future of Customer Engagement With Chatbots,https://botpress.com/blog/ideas-for-customer-engagement-with-bots,"November 11, 2021"
How Does a Chatbot Work?,https://botpress.com/blog/how-chatbot-works,"October 29, 2020"
Why Chatbots Are the Future?,https://botpress.com/blog/why-chatbots-are-the-future,"December 17, 2021"
Chatbot Platform Comparison,https://botpress.com/blog/chatbot-platform-comparison,"September 24, 2021"
The Use of AI in Chatbots,https://botpress.com/blog/the-use-of-ai-in-chatbots,"October 21, 2020"
ROI for Chatbots,https://botpress.com/blog/roi-for-chatbots,"September 6, 2022"
Successful Chatbot Projects Avoid These Mistakes,https://botpress.com/blog/successful-chatbot-projects-avoid-these-mistakes,"May 27, 2022"
A Framework to Think About the Future of Chatbots,https://botpress.com/blog/a-framework-to-think-about-the-future-of-chatbots,"May 27, 2022"
13 Mistakes to Avoid When Creating Chatbots,https://botpress.com/blog/13-mistakes-to-avoid-when-creating-chatbots,"January 31, 2022"
Why Alexa and Google Assistant Are Not the Future for Business Chatbots,https://botpress.com/blog/alexa-and-google-assistant-are-not-the-future-for-business-chatbots,"December 17, 2021"
What is Chatbot Analytics? Learn more about chatbot analytics and key chatbot metrics,https://botpress.com/blog/chatbot-analytics,"October 7, 2022"
Chatbot Business Models,https://botpress.com/blog/chatbot-business-models,"January 24, 2022"
Chatbot for Airlines,https://botpress.com/blog/chatbot-for-airlines,"May 27, 2022"
Chatbot for Education,https://botpress.com/blog/chatbot-for-education,"December 21, 2021"
Chatbot for Real Estate,https://botpress.com/blog/chatbot-for-real-estate,"December 21, 2021"
Chatbots for Drones,https://botpress.com/blog/chatbots-for-drones,"July 29, 2021"
Chatbots for Government,https://botpress.com/blog/chatbots-for-government,"May 27, 2022"
Chatbot for HR,https://botpress.com/blog/chatbot-for-hr,"November 4, 2021"
Chatbot for Restaurants,https://botpress.com/blog/chatbot-for-restaurants,"May 27, 2022"
Chatbot Personalization and Value,https://botpress.com/blog/chatbot-personalization-and-value,"July 29, 2021"
Chatbot for Sales,https://botpress.com/blog/chatbot-for-sales,"November 15, 2021"
4 Essential Chatbot Security Requirements You Need to Know,https://botpress.com/blog/chatbot-security,"May 20, 2022"
Chatbot Platforms: Developers and Business Users,https://botpress.com/blog/chatbot-platforms-developers-and-business-users,"August 27, 2021"
Chatbot for Banking,https://botpress.com/blog/chatbot-for-banking,"November 4, 2021"
How to Overcome the Top Seven Risks of Your First Chatbot Project,https://botpress.com/blog/how-to-overcome-the-seven-top-risks-of-your-first-chatbot-project,"January 21, 2022"
Five Ways Successful Business Leaders Drive Employee Adoption of New Chatbot Solutions.,https://botpress.com/blog/five-ways-employee-adoption-chatbot,"December 21, 2021"
Top Health Chatbots for 2021,https://botpress.com/blog/top-health-chatbots-for-2021,"February 18, 2022"
Business Process Automation and Chatbots,https://botpress.com/blog/business-process-automation-chatbots,"May 27, 2022"
How to build a Facebook Chatbot to answer your customers,https://botpress.com/blog/how-to-build-a-facebook-chatbot-to-answer-your-customers,"May 20, 2022"
Top chatbots in financial services for 2021,https://botpress.com/blog/top-chatbots-financial-services,"February 18, 2022"
Chatbots for manufacturing industry | Benefits & Use Cases,https://botpress.com/blog/chatbots-for-manufacturing-industry,"April 8, 2022"
"Difference between a bot, a chatbot, a NLP chatbot and all the rest?",https://botpress.com/blog/nlp-chatbot,"December 21, 2021"
TEST 1: The Roles and Customer Outcomes of Conversational AI,https://botpress.com/blog/conversational-ai-customer-outcomes,"March 4, 2022"
AI Chatbots in Insurance | Top Use Cases & Benefits,https://botpress.com/blog/ai-chatbots-in-insurance-top-use-cases-benefits,"May 27, 2022"
The Difference Between Bot and Conversational AI,https://botpress.com/blog/difference-between-bot-conversational-ai,"December 23, 2021"
How to Increase CSAT and Drive Customer Engagement with Digital Assistants,https://botpress.com/blog/increase-csat-drive-customer-engagement,"May 6, 2022"
Announcing our $15M Series A: Open developer stack for building Conversational AI applications,https://botpress.com/blog/announcing-15m-series-a,"July 29, 2021"
Using Botpress v12 Actions with the Giphy API,https://botpress.com/blog/using-botpress-actions-with-the-giphy-api,"March 28, 2022"
Natural Language Processing & Natural Language Understanding: In-Depth Guide in 2021,https://botpress.com/blog/guide-to-nlp-nlu,"December 23, 2021"
Getting Started with Botpress,https://botpress.com/blog/getting-started-with-botpress,"May 27, 2022"
NLP & the Botpress NLU strategy,https://botpress.com/blog/nlp-the-botpress-nlu-strategy,"December 23, 2021"
How to Deploy a Chatbot for Fun & Profit,https://botpress.com/blog/how-to-deploy-a-chatbot-with-docker,"September 14, 2021"
How to setup HTTPS with Botpress,https://botpress.com/blog/how-to-setup-https-with-botpress,"March 28, 2022"
Building a Mars Rover Photography Chatbot - The Video Walkthrough,https://botpress.com/blog/building-the-mars-rover-photography-bot,"October 21, 2021"
What’s Happening at Botpress: August and September 2021 Recap,https://botpress.com/blog/whats-happening-at-botpress-august-and-september-2021-recap,"December 7, 2021"
Mars Rover Photography Chatbot - The Blog,https://botpress.com/blog/mars-rover-tutorial-blog,"October 21, 2021"
Deploying botpress on AWS,https://botpress.com/blog/deploying-botpress-on-aws,"February 17, 2022"
What’s Happening at Botpress: October 2021 Recap,https://botpress.com/blog/whats-happening-at-botpress-october-2021-recap,"December 21, 2021"
Guest Post: How to Integrate Twilio with Botpress on a Window environment,https://botpress.com/blog/guest-post-how-to-integrate-twilio-with-botpress-on-a-window-environment,"November 20, 2021"
"The People of Botpress: François-Xavier Darveau, Head of Engineering",https://botpress.com/blog/the-people-of-botpress-francois-xavier-darveau-head-of-engineering,"May 27, 2022"
"The People of Botpress: Nadine Ungerer, Head of Customer Success",https://botpress.com/blog/the-people-of-botpress-nadine-ungerer-head-of-customer-success,"November 16, 2021"
What’s Happening at Botpress: November 2021 Recap,https://botpress.com/blog/whats-happening-at-botpress-november-2021-recap,"December 7, 2021"
What’s Happening at Botpress: December 2021 Recap,https://botpress.com/blog/whats-happening-at-botpress-december-2021-recap,"February 17, 2022"
"The People of Botpress: Jean-Bernard Perron, Chief Financial Officer",https://botpress.com/blog/the-people-of-botpress-jean-bernard-perron-chief-financial-officer,"May 24, 2022"
What’s Happening at Botpress: January 2022 Recap,https://botpress.com/blog/whats-happening-at-botpress-january-2022-recap,"March 3, 2022"
Integrating Different Messaging Channels with Botpress v12,https://botpress.com/blog/channel-integration,"January 27, 2022"
What’s Happening at Botpress: February 2022,https://botpress.com/blog/whats-happening-at-botpress-february-2022-recap,"March 3, 2022"
"The People of Botpress: Sylvain Perron, CEO and Co-Founder",https://botpress.com/blog/the-people-of-botpress-sylvain-perron,"April 29, 2022"
Botpress vs Dialogflow ES vs Dialogflow CX in 2022 [Part one],https://botpress.com/blog/botpress-vs-dialogflow-es-vs-dialogflow-cx,"May 6, 2022"
How to Add Languages to the Botpress NLU,https://botpress.com/blog/adding-language-to-botpress-nlu-not-supported-by-default,"May 4, 2022"
What does an internal Botpress hackathon look like?,https://botpress.com/blog/internal-hackthon,"March 10, 2022"
"The People of Botpress: Michael Masson, Site Reliability Developer",https://botpress.com/blog/the-people-of-botpress-michael-masson,"March 30, 2022"
What’s Happening at Botpress: March 2022,https://botpress.com/blog/whats-happening-at-botpress-march-2022-recap,"March 30, 2022"
Botpress vs Dialogflow ES vs Dialogflow CX in 2022 [Part two],https://botpress.com/blog/botpress-vs-dialogflow-es-vs-dialogflow-cx-2,"April 21, 2022"
Introducing OpenBook from Botpress,https://botpress.com/blog/introducing-openbook,"May 26, 2022"
Announcing Botpress Cloud,https://botpress.com/blog/botpress-cloud,"May 25, 2022"
How to Quickly and Easily Build a WhatsApp Chatbot For Free,https://botpress.com/blog/how-to-quickly-and-easily-build-a-whatsapp-chatbot,"May 27, 2022"
What’s Happening at Botpress: April 2022,https://botpress.com/blog/whats-happening-at-botpress-april-2022,"April 29, 2022"
"The People of Botpress: Francois Levasseur, Software Developer",https://botpress.com/blog/the-people-of-botpress-francois-levasseur-1,"May 9, 2022"
Introducing the Botpress Learning Center,https://botpress.com/blog/botpress-learning-center,"May 26, 2022"
What's Happening at Botpress: May 2022,https://botpress.com/blog/whats-happening-at-botpress-may-2022,"May 23, 2022"
How to Add Dashbot to Botpress for Chatbot Analytics,https://botpress.com/blog/how-to-add-dashbot-to-botpress-for-chatbot-analytics,"July 18, 2022"
What is natural language understanding (NLU)?,https://botpress.com/blog/what-is-natural-language-understanding-nlu,"October 7, 2022"
Why are chatbots important?,https://botpress.com/blog/why-are-chatbots-important,"November 22, 2022"
