Title,Title_URL,Image,Tag,Field,Avatar,Content,Content1,postcardbylinedate,postcardbylinedate2
Email Outreach Strategies You Can and Should Be Using,https://instantly.ai/blog/outreach-strategies,https://instantly.foomonk.com/content/images/2022/12/image3-1.png,,"Email outreach strategies are a necessary part of every email campaign building. A campaign without a strategy will never be as effective as a well-planned, organized one. Understanding the best way to strategize for each campaign will undoubtedly increase the chances of success.",https://instantly.foomonk.com/content/images/2022/05/Screenshot-2022-05-25-at-10.19.19.png,https://instantly.ai/blog/author/raul,RAUL KAEVAND,30 Dec 2022 •  8 min read,30 DEC 2022 
Top 15 Tested And Proven Email Marketing Best Practices For 2023,https://instantly.ai/blog/email-marketing-best-practices,https://instantly.foomonk.com/content/images/2022/12/image3.png,,"Email marketing is king when it comes to driving engagement and increasing conversions. It’s sustainable, cost-effective, and one of the most effective ways of reaching your target audience.",https://instantly.foomonk.com/content/images/2022/05/Screenshot-2022-05-25-at-10.19.19.png,https://instantly.ai/blog/author/raul,RAUL KAEVAND,30 Dec 2022 •  9 min read,30 DEC 2022 
Startup Lead Generation Strategies That Actually Work,https://instantly.ai/blog/lead-generation-strategies,https://instantly.foomonk.com/content/images/2022/12/image5.png,COLD EMAIL,"Having an effective lead generation strategy is crucial to the success of any startup, but it can be hard to pinpoint the proper steps to take with so many options out there. Here are 9 proven startup lead-gen strategies you can take to the bank.",https://instantly.foomonk.com/content/images/2022/05/Screenshot-2022-05-25-at-10.19.19.png,https://instantly.ai/blog/author/raul,RAUL KAEVAND,30 Dec 2022 •  9 min read,30 DEC 2022 
The Email Marketing Software Scaling Businesses Need,https://instantly.ai/blog/email-marketing-software,https://instantly.foomonk.com/content/images/2022/12/image1.png,,"Scaling businesses need tools that drive growth. Picking the right tool is a task that needs to be considered with care, as the right one can supercharge a business’s growth.",https://instantly.foomonk.com/content/images/2022/05/Screenshot-2022-05-25-at-10.19.19.png,https://instantly.ai/blog/author/raul,RAUL KAEVAND,30 Dec 2022 •  8 min read,30 DEC 2022 
Level Up Your Influencer Outreach With These Tips and Tricks,https://instantly.ai/blog/influencer-outreach,https://instantly.foomonk.com/content/images/2022/12/influencer-outreach.jpg,COLD EMAIL,"Influencer outreach is a great way to quickly expand your business, build trust, and generate quality leads. Learn how it's done here.",https://instantly.foomonk.com/content/images/2022/05/Screenshot-2022-05-25-at-10.19.19.png,https://instantly.ai/blog/author/raul,RAUL KAEVAND,29 Dec 2022 •  5 min read,29 DEC 2022 
What Are MX Records and Do They Affect Email Deliverability?,https://instantly.ai/blog/mx-records,https://instantly.foomonk.com/content/images/2022/12/mx-records.jpg,COLD EMAIL,"MX records, or mail exchanger records, are a critical component of email deliverability. Learn why here.",https://instantly.foomonk.com/content/images/2022/05/Screenshot-2022-05-25-at-10.19.19.png,https://instantly.ai/blog/author/raul,RAUL KAEVAND,29 Dec 2022 •  2 min read,29 DEC 2022 
Adding Attachments in Cold Emails: The Final Verdict,https://instantly.ai/blog/attachments-in-cold-emails,https://instantly.foomonk.com/content/images/2022/12/attachments-in-cold-emails.jpg,COLD EMAIL,There is no debate on whether or not you can add attachments to cold emails. Here are the reasons why you should avoid attachments in cold email campaigns.,https://instantly.foomonk.com/content/images/2022/05/Screenshot-2022-05-25-at-10.19.19.png,https://instantly.ai/blog/author/raul,RAUL KAEVAND,29 Dec 2022 •  5 min read,29 DEC 2022 
Maximizing Your ROI: The 8 Email Marketing Metrics to Monitor,https://instantly.ai/blog/email-marketing-metrics,https://instantly.foomonk.com/content/images/2022/12/metrics_-_featured.png,,"Email marketing metrics are crucial to aid your understanding of just how successful a campaign is. They measure everything from return on investment to open rate, bounce rate to conversion rate. The key is to understand how to track them, and then use them to strategize moving forward.",https://instantly.foomonk.com/content/images/2022/05/Screenshot-2022-05-25-at-10.19.19.png,https://instantly.ai/blog/author/raul,RAUL KAEVAND,29 Dec 2022 •  6 min read,29 DEC 2022 
Eye-Opening Email Marketing Statistics That Can Help Boost Your Business,https://instantly.ai/blog/email-marketing-statistics,https://instantly.foomonk.com/content/images/2022/12/email-marketing-statistics.jpg,,Are you looking to skyrocket your conversion rate in 2023? Get ready to take off by checking out these email marketing statistics.,https://instantly.foomonk.com/content/images/2022/05/Screenshot-2022-05-25-at-10.19.19.png,https://instantly.ai/blog/author/raul,RAUL KAEVAND,29 Dec 2022 •  4 min read,29 DEC 2022 
How to Revamp Your Outreach Campaigns With Email Automation,https://instantly.ai/blog/email-automation,https://instantly.foomonk.com/content/images/2022/12/email-automation.jpg,COLD EMAIL,Sending personalized emails in bulk sounds impossible. Think about the amount of time it takes to draft each email. You could be stuck doing this for hours. Luckily we have email automation that helps streamline this process.,https://instantly.foomonk.com/content/images/2022/05/Screenshot-2022-05-25-at-10.19.19.png,https://instantly.ai/blog/author/raul,RAUL KAEVAND,29 Dec 2022 •  9 min read,29 DEC 2022 
How to Send a Follow-up Email After No Response + Examples,https://instantly.ai/blog/how-to-send-a-follow-up-email,https://instantly.foomonk.com/content/images/2022/12/follow-up-email-after-no-response.jpg,COLD EMAIL,"Sending that first cold email is absolutely nerve-wracking. You can get stuck for days with no response.

You could be asking yourself if you should give up on a lead or send a follow-up. But are follow-ups even worth the effort? The short answer will always be yes! ",https://instantly.foomonk.com/content/images/2022/05/Screenshot-2022-05-25-at-10.19.19.png,https://instantly.ai/blog/author/raul,RAUL KAEVAND,29 Dec 2022 •  5 min read,29 DEC 2022 
12 Recruiter Email Templates to Win Over Candidates,https://instantly.ai/blog/recruiter-emails-to-candidates,https://instantly.foomonk.com/content/images/2022/11/we-are-hiring-2578901_1920.jpg,COLD EMAIL,A candidate’s experience reflects on a company’s brand. That’s why the best companies promote quality and consistent communication as part of the application process to win candidates over.,https://instantly.foomonk.com/content/images/2022/05/Screenshot-2022-05-25-at-10.19.19.png,https://instantly.ai/blog/author/raul,RAUL KAEVAND,25 Nov 2022 •  8 min read,25 NOV 2022 
29 Effective and Catchy Email Subject Lines for Sales Emails,https://instantly.ai/blog/catchy-email-subject-lines-for-sales-emails,https://instantly.foomonk.com/content/images/2022/11/catchy-subject-lines-for--sales-emails.jpg,COLD EMAIL,"Spending hours researching prospects and creating quality content go to waste if sent emails aren’t opened. If this is a recurring theme, your sales email subject lines could be the issue.",https://instantly.foomonk.com/content/images/2022/05/Screenshot-2022-05-25-at-10.19.19.png,https://instantly.ai/blog/author/raul,RAUL KAEVAND,25 Nov 2022 •  9 min read,25 NOV 2022 
The Top Klenty Competitors of 2022: How Do They Stack Up?,https://instantly.ai/blog/the-top-klenty-competitors-of-2022-how-do-they-stack-up,https://instantly.foomonk.com/content/images/2022/11/klenty-competitors.jpg,,"Using an efficient sales engagement platform that boosts connections between consumers and businesses is becoming a mandatory tool for many brands. Klenty makes for a good option, but there are a growing number of more attractive alternatives.",https://instantly.foomonk.com/content/images/2022/05/Screenshot-2022-05-25-at-10.19.19.png,https://instantly.ai/blog/author/raul,RAUL KAEVAND,25 Nov 2022 •  9 min read,25 NOV 2022 
Best Salesloft Competitors and Alternatives to Consider in 2023,https://instantly.ai/blog/salesloft-competitors,https://instantly.foomonk.com/content/images/2022/11/salesloft-competitors.jpg,,"Salesloft is a well-established sales engagement platform (SEP) that allows sales teams to generate, track, and scale their leads with detailed sales funnels and pipelines. However, if you’re looking for better alternatives in terms of price and features, this article is for you.",https://instantly.foomonk.com/content/images/2022/05/Screenshot-2022-05-25-at-10.19.19.png,https://instantly.ai/blog/author/raul,RAUL KAEVAND,25 Nov 2022 •  9 min read,25 NOV 2022 
13 Essential Email Marketing Tips to Boost Open Rates,https://instantly.ai/blog/email-marketing-tips,https://instantly.foomonk.com/content/images/2022/11/student-849826_1920.jpg,COLD EMAIL,"Email is still one of the most effective marketing tools out there, and is preferred by millions of businesses as a way to create meaningful relationships and grow their brand. Here are some top tips to help you do the same.",https://instantly.foomonk.com/content/images/2022/05/Screenshot-2022-05-25-at-10.19.19.png,https://instantly.ai/blog/author/raul,RAUL KAEVAND,25 Nov 2022 •  6 min read,25 NOV 2022 
Email Sending Limits of Top Email Service Providers,https://instantly.ai/blog/email-sending-limits,https://instantly.foomonk.com/content/images/2022/11/computer-1185569_1920.jpg,COLD EMAIL,"Great email marketing gets you leads. It’s a tested and proven strategy. But even with great content, email marketing is still a numbers game. ",https://instantly.foomonk.com/content/images/2022/05/Screenshot-2022-05-25-at-10.19.19.png,https://instantly.ai/blog/author/raul,RAUL KAEVAND,25 Nov 2022 •  8 min read,25 NOV 2022 
13 Powerful Email Personalization Tips That Drive Engagement,https://instantly.ai/blog/email-personalization,https://instantly.foomonk.com/content/images/2022/11/email-personalization.jpg,COLD EMAIL,"As a marketer, standing out in the email space can be challenging. With so much competition, finding new ways to engage with prospects is important. Email personalization is one great way to do that. ",https://instantly.foomonk.com/content/images/2022/05/Screenshot-2022-05-25-at-10.19.19.png,https://instantly.ai/blog/author/raul,RAUL KAEVAND,25 Nov 2022 •  7 min read,25 NOV 2022 
The Best Woodpecker Alternative of 2022 | Instantly,https://instantly.ai/blog/the-best-woodpecker-alternative-of-2022-instantly,https://instantly.foomonk.com/content/images/2022/10/MANAGEMENT--3-.png,,Many businesses are turning to state-of-the-art email marketing tools that not only automate and make the process more efficient but also increase leads and conversions. Woodpecker is one such option— working for some but not all. Here we discuss our favorite alternatives. ,https://instantly.foomonk.com/content/images/2022/05/Screenshot-2022-05-25-at-10.19.19.png,https://instantly.ai/blog/author/raul,RAUL KAEVAND,31 Oct 2022 •  8 min read,31 OCT 2022 
Best Yesware Alternatives for Email Outreach in 2023,https://instantly.ai/blog/yesware-alternatives,https://instantly.foomonk.com/content/images/2022/10/MANAGEMENT--2-.png,COLD EMAIL,"Email outreach requires a good tool to get the job done and avoid being buried in an avalanche of admin. There’s no way that you’ll be efficient and successful without one when working at scale. Yesware is one such tool, but there are lots of other great alternatives available on the market.",https://instantly.foomonk.com/content/images/2022/05/Screenshot-2022-05-25-at-10.19.19.png,https://instantly.ai/blog/author/raul,RAUL KAEVAND,31 Oct 2022 •  7 min read,31 OCT 2022 
The 10 Best Outreach.io Alternatives to Choose in 2023,https://instantly.ai/blog/outreach-io-alternatives,https://instantly.foomonk.com/content/images/2022/10/MANAGEMENT--1-.png,,"Outreach is considered a premium sales engagement software that lets teams engage with leads and prospects across multiple channels. Whether it’s their pricing, limited email features, or complicated UI, there are many reasons to look for an alternative.",https://instantly.foomonk.com/content/images/2022/05/Screenshot-2022-05-25-at-10.19.19.png,https://instantly.ai/blog/author/raul,RAUL KAEVAND,26 Oct 2022 •  9 min read,26 OCT 2022 
How to Use Cold Email to Sell Consulting Services,https://instantly.ai/blog/sell-consulting-services,https://instantly.foomonk.com/content/images/2022/10/bruce-mars-8YG31Xn4dSw-unsplash.jpg,,"Tons of businesses offer in-demand skills and services. Unfortunately, most are left in the dust against the competition due to a ineffective outreach.",https://instantly.foomonk.com/content/images/2022/05/Screenshot-2022-05-25-at-10.19.19.png,https://instantly.ai/blog/author/raul,RAUL KAEVAND,26 Oct 2022 •  4 min read,26 OCT 2022 
How to Write an Effective Email Nurture Sequence,https://instantly.ai/blog/email-nurture-sequence,https://instantly.foomonk.com/content/images/2022/10/bradyn-trollip-pxVOztBa6mY-unsplash.jpg,COLD EMAIL,"Getting your prospects’ email addresses is only half the battle, the rest comes down to ensuring they stay. This is done by consistently providing value for your audience so they open every email you send.",https://instantly.foomonk.com/content/images/2022/05/Screenshot-2022-05-25-at-10.19.19.png,https://instantly.ai/blog/author/raul,RAUL KAEVAND,26 Oct 2022 •  5 min read,26 OCT 2022 
Top 8 Mailshake Alternatives and Competitors,https://instantly.ai/blog/mailshake-alternative,https://instantly.foomonk.com/content/images/2022/10/MANAGEMENT.png,,"Mailshake is no doubt a popular email tool used by many businesses but is not without its drawbacks. If you’re looking for a better alternative, then don’t worry, that’s exactly what we’ve got lined up in this article.",https://instantly.foomonk.com/content/images/2022/05/Screenshot-2022-05-25-at-10.19.19.png,https://instantly.ai/blog/author/raul,RAUL KAEVAND,25 Oct 2022 •  9 min read,25 OCT 2022 
7 Email Copywriting Best Practices to Follow,https://instantly.ai/blog/email-copywriting,https://instantly.foomonk.com/content/images/2022/10/pexels-ivan-samkov-4238478.jpg,,"When it comes to crafting the right email, it’s easy to overthink things and get caught up in the details. But with a few fundamental and data-backed approaches, email copywriting can become a lot simpler and allow you to unlock new levels of potential.",https://instantly.foomonk.com/content/images/2022/05/Screenshot-2022-05-25-at-10.19.19.png,https://instantly.ai/blog/author/raul,RAUL KAEVAND,25 Oct 2022 •  6 min read,25 OCT 2022 
Overcoming Common Objections: How to Close More Sales,https://instantly.ai/blog/overcoming-objections,https://instantly.foomonk.com/content/images/2022/10/pexels-linkedin-sales-navigator-2182981.jpg,COLD EMAIL,"If you’re in sales, then you know objections, rejections, and everything in between is a natural part of the role. Read on to learn how you can easily bypass the most common excuses, doubts, and foot-dragging without being pushy and closing that deal.",https://instantly.foomonk.com/content/images/2022/05/Screenshot-2022-05-25-at-10.19.19.png,https://instantly.ai/blog/author/raul,RAUL KAEVAND,25 Oct 2022 •  8 min read,25 OCT 2022 
Local Lead Generation: How to Generate Quality Local Leads,https://instantly.ai/blog/generate-local-leads,https://instantly.foomonk.com/content/images/2022/09/pexels-altaf-shah-8314415.jpg,,"Driving growth locally can be stressful for a business, especially when starting out. But with a few key steps, you can attract the right kind of leads that will make your business thrive.",https://instantly.foomonk.com/content/images/2022/05/Screenshot-2022-05-25-at-10.19.19.png,https://instantly.ai/blog/author/raul,RAUL KAEVAND,26 Sep 2022 •  5 min read,26 SEP 2022 
The Ultimate List of 700+ Spam Trigger Words to Avoid in 2023,https://instantly.ai/blog/spam-trigger-words,https://instantly.foomonk.com/content/images/2022/09/Add-a-heading--3-.png,,The last thing you want after preparing an awesome email outreach campaign is to get flagged for using a combination of spam trigger words in your email subject lines. Here’s an ultimate list of spam trigger words to steer clear of.,https://instantly.foomonk.com/content/images/2022/05/Screenshot-2022-05-25-at-10.19.19.png,https://instantly.ai/blog/author/raul,RAUL KAEVAND,22 Sep 2022 •  7 min read,22 SEP 2022 
Instantly: The Best Lemlist Alternative of 2023,https://instantly.ai/blog/lemlist-alternative,https://instantly.foomonk.com/content/images/2022/09/MANAGEMENT--2-.png,COLD EMAIL,"Email marketing software is quickly becoming a must-have tool for many businesses. Many find that Lemlist is a great bet and works well. For the majority, however, Instantly makes for a better alternative.",https://instantly.foomonk.com/content/images/2022/05/Screenshot-2022-05-25-at-10.19.19.png,https://instantly.ai/blog/author/raul,RAUL KAEVAND,22 Sep 2022 •  10 min read,22 SEP 2022 
How to Write a Press Release Email Pitch + Free Template,https://instantly.ai/blog/press-release-email-template,https://instantly.foomonk.com/content/images/2022/09/pexels-madison-inouye-1577882.jpg,COLD EMAIL,"Getting your brand covered by the media can bring in a level of exposure that far surpasses common marketing strategies like email campaigns, ads, and social media. But how can you get the word out to journalists in a way that inspires action on their part? Read on to find out.",https://instantly.foomonk.com/content/images/2022/05/Screenshot-2022-05-25-at-10.19.19.png,https://instantly.ai/blog/author/raul,RAUL KAEVAND,21 Sep 2022 •  5 min read,21 SEP 2022 
Custom Tracking Domains: What They Are and Why They Matter,https://instantly.ai/blog/what-is-a-custom-tracking-domain,https://instantly.foomonk.com/content/images/2022/09/MANAGEMENT--1-.png,,"No email campaign would be complete without open and link click tracking, which is what a tracking domain does. But what are the benefits of having a custom one for yourself and how can you create one? Read on to find out.",https://instantly.foomonk.com/content/images/2022/05/Screenshot-2022-05-25-at-10.19.19.png,https://instantly.ai/blog/author/raul,RAUL KAEVAND,21 Sep 2022 •  4 min read,21 SEP 2022 
Best Email Subject Lines for Outbound Sales,https://instantly.ai/blog/best-email-subject-lines-for-outbound-sales,https://instantly.foomonk.com/content/images/2022/09/pexels-markus-winkler-4052194.jpg,COLD EMAIL,"Open rates and conversions depend heavily on subject lines, and writing up the right one can be quite the responsibility. But don’t worry, here are top-performing subject lines you can use to raise your sales outreach to the next level.",https://instantly.foomonk.com/content/images/2022/05/Screenshot-2022-05-25-at-10.19.19.png,https://instantly.ai/blog/author/raul,RAUL KAEVAND,20 Sep 2022 •  7 min read,20 SEP 2022 
10 Professional Outreach Email Templates You Can Steal Today,https://instantly.ai/blog/outreach-email-templates,https://instantly.foomonk.com/content/images/2022/09/sales-engagement-1.png,COLD EMAIL,"Cold email outreach is a popular marketing strategy that generates leads, builds brands, expands networks, all at a fraction of the cost when compared to other direct marketing methods.",https://instantly.foomonk.com/content/images/2022/05/Screenshot-2022-05-25-at-10.19.19.png,https://instantly.ai/blog/author/raul,RAUL KAEVAND,20 Sep 2022 •  7 min read,20 SEP 2022 
7 Best Sales Engagement Platforms for Higher Conversions,https://instantly.ai/blog/sales-engagement-platforms,https://instantly.foomonk.com/content/images/2022/09/sales-sales-enagement-software.jpg,COLD EMAIL, Sales engagement platforms allow businesses to get the most out of their outreach with multi-channel personalized campaigns that drive conversions. Here are some of the best sales engagement platforms and tools to check out.,https://instantly.foomonk.com/content/images/2022/05/Screenshot-2022-05-25-at-10.19.19.png,https://instantly.ai/blog/author/raul,RAUL KAEVAND,20 Sep 2022 •  7 min read,20 SEP 2022 
5 Best Mail Merge Software for Email Marketers in 2023,https://instantly.ai/blog/mail-merge-software,https://instantly.foomonk.com/content/images/2022/09/MANAGEMENT.png,COLD EMAIL,"If you’re looking to boost open and reply rates with personalization, then mail merge software is exactly what you need. ",https://instantly.foomonk.com/content/images/2022/05/Screenshot-2022-05-25-at-10.19.19.png,https://instantly.ai/blog/author/raul,RAUL KAEVAND,20 Sep 2022 •  7 min read,20 SEP 2022 
Hard Bounce Vs Soft Bounce Emails: What's The Difference?,https://instantly.ai/blog/soft-bounce-vs-hard-bounce,https://instantly.foomonk.com/content/images/2022/08/hard-bounce-vs-soft-bounce.jpg,COLD EMAIL,"An email bounce can occur for a variety of reasons. Depending on the type, it can negatively affect email deliverability and become a real issue for email marketing campaigns.",https://instantly.foomonk.com/content/images/2022/05/Screenshot-2022-05-25-at-10.19.19.png,https://instantly.ai/blog/author/raul,RAUL KAEVAND,25 Aug 2022 •  3 min read,25 AUG 2022 
How to Write a Cold Email Follow-Up (With Templates),https://instantly.ai/blog/cold-email-follow-up-templates,https://instantly.foomonk.com/content/images/2022/08/cold-email-follow-up.jpg,COLD EMAIL,Sending email follow-ups is a super technique that is rarely used to its full potential. Learn how you can write a cold email follow-up that keeps the conversation flowing.,https://instantly.foomonk.com/content/images/2022/05/Screenshot-2022-05-25-at-10.19.19.png,https://instantly.ai/blog/author/raul,RAUL KAEVAND,25 Aug 2022 •  6 min read,25 AUG 2022 
(Cold) Sales Pitch Examples To Take to the Bank,https://instantly.ai/blog/cold-sales-pitch-examples,https://instantly.foomonk.com/content/images/2022/08/sales-pitch-examples.jpg,COLD EMAIL,"When most people think of sales pitches, pushy images of salesmen often come to mind. But there’s so much more to a sales pitch that can make it stand out and present a solution to a real problem.",https://instantly.foomonk.com/content/images/2022/05/Screenshot-2022-05-25-at-10.19.19.png,https://instantly.ai/blog/author/raul,RAUL KAEVAND,25 Aug 2022 •  4 min read,25 AUG 2022 
Why Are My Emails Going To Spam? What Is Email Deliverability?,https://instantly.ai/blog/why-are-my-emails-going-to-spam,https://instantly.foomonk.com/content/images/2022/08/why-are-my-emails-going-to-spam.jpg,COLD EMAIL,"Having a good reputation is key to avoiding spam folders, but despite that, outreach emails can still get flagged. Learn how you can pass the spam filters.",https://instantly.foomonk.com/content/images/2022/05/Screenshot-2022-05-25-at-10.19.19.png,https://instantly.ai/blog/author/raul,RAUL KAEVAND,25 Aug 2022 •  7 min read,25 AUG 2022 
13 Powerful Cold Email Statistics You Should Know in 2023,https://instantly.ai/blog/cold-email-statistics,https://instantly.foomonk.com/content/images/2022/08/cold-email-statistics.jpg,COLD EMAIL,"Sending cold emails can be challenging, but seeing what in-depth research has to say on the power of cold emailing will give you insights on how to craft a successful strategy.",https://instantly.foomonk.com/content/images/2022/05/Screenshot-2022-05-25-at-10.19.19.png,https://instantly.ai/blog/author/raul,RAUL KAEVAND,25 Aug 2022 •  4 min read,25 AUG 2022 
Email Alias 101: What They Mean and Why They're Important,https://instantly.ai/blog/email-alias-101,https://instantly.foomonk.com/content/images/2022/08/email-alias.jpg,COLD EMAIL,An email alias is an email linked to a primary email account that can send/receive emails on its behalf. Learn about their benefits and if you should use them.,https://instantly.foomonk.com/content/images/2022/05/Screenshot-2022-05-25-at-10.19.19.png,https://instantly.ai/blog/author/raul,RAUL KAEVAND,24 Aug 2022 •  3 min read,24 AUG 2022 
How to Do Cold Email Outreach for Backlinks (Off-Page SEO),https://instantly.ai/blog/cold-email-outreach-for-backlinks,https://instantly.foomonk.com/content/images/2022/08/email-outreach-for-backlinks.jpg,COLD EMAIL,Cold emails are essential to building backlinks. Read on to learn more about cold outreach strategies that you can use to boost your backlink building campaign.,https://instantly.foomonk.com/content/images/2022/05/Screenshot-2022-05-25-at-10.19.19.png,https://instantly.ai/blog/author/raul,RAUL KAEVAND,24 Aug 2022 •  5 min read,24 AUG 2022 
How to Send a Cold Email for a Virtual Coffee Meeting,https://instantly.ai/blog/virtual-coffee-meeting-cold-email,https://instantly.foomonk.com/content/images/2022/08/virtual-coffee-meeting.jpg,COLD EMAIL,Thinking of hosting a virtual coffee meeting with a prospect you don't know? Check out our guide on how to send a cold email for a virtual coffee meeting.,https://instantly.foomonk.com/content/images/2022/05/Screenshot-2022-05-25-at-10.19.19.png,https://instantly.ai/blog/author/raul,RAUL KAEVAND,24 Aug 2022 •  6 min read,24 AUG 2022 
The Only Cold Email Marketing Strategy You Need In 2023,https://instantly.ai/blog/cold-email-marketing-strategy,https://instantly.foomonk.com/content/images/2022/08/cold-email-marketing.jpg,COLD EMAIL,Cold email marketing is a cost-effective way to build your brand. Read on to learn how you can easily create a successful cold email marketing campaign in 2023.,https://instantly.foomonk.com/content/images/2022/05/Screenshot-2022-05-25-at-10.19.19.png,https://instantly.ai/blog/author/raul,RAUL KAEVAND,24 Aug 2022 •  6 min read,24 AUG 2022 
