Title,Title_URL,Image,Tag,Field,Avatar,Content,Content1,postcardbylinedate,postcardbylinedate2
5 Personalized Cold Email Examples To Inspire Your Outreach,https://instantly.ai/blog/personalized-cold-email-examples,https://instantly.foomonk.com/content/images/2023/11/cold-email-examples.jpg,,These 5 personalized cold email examples are the perfect inspiration before you start writing your next cold email marketing campaign.,https://instantly.foomonk.com/content/images/2022/05/Screenshot-2022-05-25-at-10.19.19.png,https://instantly.ai/blog/author/raul,RAUL KAEVAND,1 Nov 2023 •  6 min read,1 NOV 2023 
Lead Finder Tools For Maintaining Healthy Sales Pipelines,https://instantly.ai/blog/lead-finder-tools,https://instantly.foomonk.com/content/images/2023/10/lead-finder-tools.jpg,COLD EMAIL,Lead finder tools paired with quality lead sources help you establish sustainable and healthy sales pipelines. Here are the tools we recommend.,https://instantly.foomonk.com/content/images/2022/05/Screenshot-2022-05-25-at-10.19.19.png,https://instantly.ai/blog/author/raul,RAUL KAEVAND,31 Oct 2023 •  7 min read,31 OCT 2023 
Grow Faster With An Automated Email Follow-up Strategy,https://instantly.ai/blog/automated-email-follow-up-strategy,https://instantly.foomonk.com/content/images/2023/10/automated-email-followup.jpg,COLD EMAIL,"An automated email follow-up removes the guesswork from your campaigns, offers higher response rates, and improves conversions. Here’s how to set it up. ",https://instantly.foomonk.com/content/images/2022/05/Screenshot-2022-05-25-at-10.19.19.png,https://instantly.ai/blog/author/raul,RAUL KAEVAND,31 Oct 2023 •  6 min read,31 OCT 2023 
Where To Find Leads In Competitive Markets,https://instantly.ai/blog/where-to-find-leads,https://instantly.foomonk.com/content/images/2023/10/where-to-find-leads-1.jpg,COLD EMAIL,Find validated and relevant leads to maintain healthy pipelines. Here are 14 sources we recommend. ,https://instantly.foomonk.com/content/images/2022/05/Screenshot-2022-05-25-at-10.19.19.png,https://instantly.ai/blog/author/raul,RAUL KAEVAND,31 Oct 2023 •  7 min read,31 OCT 2023 
Convert Data Into Deals With These Sales Email Tracking Tools,https://instantly.ai/blog/sales-email-tracking-tools,https://instantly.foomonk.com/content/images/2023/10/sales-email-tracking-tools.jpg,COLD EMAIL,Sales email tracking provides insight into leads with the highest buying intent. Here are the strategies and tools you can use to track sales emails effectively. ,https://instantly.foomonk.com/content/images/2022/05/Screenshot-2022-05-25-at-10.19.19.png,https://instantly.ai/blog/author/raul,RAUL KAEVAND,30 Oct 2023 •  9 min read,30 OCT 2023 
How To Verify An Email Manually or With Automation Tools,https://instantly.ai/blog/how-to-verify-an-email-manually-or-with-automation-tools,https://instantly.foomonk.com/content/images/2023/10/how-to-verify-email.jpg,COLD EMAIL,"To sustain a healthy lead pipeline, you need to learn how to verify emails. You can do this manually or use automation tools. Here’s how.",https://instantly.foomonk.com/content/images/2022/05/Screenshot-2022-05-25-at-10.19.19.png,https://instantly.ai/blog/author/raul,RAUL KAEVAND,30 Oct 2023 •  7 min read,30 OCT 2023 
Sales Email Examples: The Art of Outreach in 5 Examples,https://instantly.ai/blog/sales-email-examples,https://instantly.foomonk.com/content/images/2023/10/sales-email-examples.jpg,COLD EMAIL,These sales email examples will inspire you to create your next sales campaign. Use them as a guide for your business and deliver quality outreach.,https://instantly.foomonk.com/content/images/2022/05/Screenshot-2022-05-25-at-10.19.19.png,https://instantly.ai/blog/author/raul,RAUL KAEVAND,30 Oct 2023 •  8 min read,30 OCT 2023 
The Top 7 Funnel-Fueling Lead Generation Companies,https://instantly.ai/blog/lead-generation-companies,https://instantly.foomonk.com/content/images/2023/10/lead-generation-companies.jpg,,Top lead generation companies can help you fill your pipeline with leads ready to convert. It’s an investment that can supercharge your business.,https://instantly.foomonk.com/content/images/2022/05/Screenshot-2022-05-25-at-10.19.19.png,https://instantly.ai/blog/author/raul,RAUL KAEVAND,30 Oct 2023 •  9 min read,30 OCT 2023 
Lead Qualification Tools: The Pathway To Sales Efficiency,https://instantly.ai/blog/lead-qualification-tools,https://instantly.foomonk.com/content/images/2023/10/lead-qualification-tools.jpg,,Using a lead qualification tool ensures that you can focus on the opportunities most likely to convert. We share 3 options designed to improve sales efficiency.,https://instantly.foomonk.com/content/images/2022/05/Screenshot-2022-05-25-at-10.19.19.png,https://instantly.ai/blog/author/raul,RAUL KAEVAND,10 Oct 2023 •  4 min read,10 OCT 2023 
5 Awesome Examples of Lead Capture Pages,https://instantly.ai/blog/lead-capture-pages,https://instantly.foomonk.com/content/images/2023/10/lead-capture-pages.jpg,,Turn website visitors into prospects by building a standout lead capture page. Here's how. ,https://instantly.foomonk.com/content/images/2022/05/Screenshot-2022-05-25-at-10.19.19.png,https://instantly.ai/blog/author/raul,RAUL KAEVAND,10 Oct 2023 •  6 min read,10 OCT 2023 
7 Proven Strategies To Prevent Emails From Going to Spam,https://instantly.ai/blog/prevent-emails-from-going-to-spam,https://instantly.foomonk.com/content/images/2023/10/prevent-email-from-going-to-spam.png,COLD EMAIL,"Strategies like warmups, domain authorization, and validation prevent emails from going to spam. But why do emails end up in spam in the first place? ",https://instantly.foomonk.com/content/images/2022/05/Screenshot-2022-05-25-at-10.19.19.png,https://instantly.ai/blog/author/raul,RAUL KAEVAND,10 Oct 2023 •  6 min read,10 OCT 2023 
Using Sales Acceleration Software to Fast Track Conversions,https://instantly.ai/blog/sales-acceleration-software,https://instantly.foomonk.com/content/images/2023/10/sales-acceleration-software.jpg,COLD EMAIL,Agile businesses rely on speed and efficiency. One of the best ways to achieve this is using powerful sales acceleration software.,https://instantly.foomonk.com/content/images/2022/05/Screenshot-2022-05-25-at-10.19.19.png,https://instantly.ai/blog/author/raul,RAUL KAEVAND,10 Oct 2023 •  6 min read,10 OCT 2023 
What Is BIMI & Why is it Essential For Email Marketing?,https://instantly.ai/blog/what-is-bimi,https://instantly.foomonk.com/content/images/2023/10/what-is-bimi.jpg,COLD EMAIL,"What is BIMI? It offers more than just a logo in an inbox. It sets standards for every email, ensuring each one is authentic. ",https://instantly.foomonk.com/content/images/2022/05/Screenshot-2022-05-25-at-10.19.19.png,https://instantly.ai/blog/author/raul,RAUL KAEVAND,10 Oct 2023 •  5 min read,10 OCT 2023 
8 Sales Engagement Tools That Make Conversions Easy,https://instantly.ai/blog/sales-engagement-tools,https://instantly.foomonk.com/content/images/2023/10/sales-engagement-tools.jpg,,"These sales engagement tools will help you connect with your audience in a more meaningful and valuable way. Do that, and easy conversions will follow.",https://instantly.foomonk.com/content/images/2022/05/Screenshot-2022-05-25-at-10.19.19.png,https://instantly.ai/blog/author/raul,RAUL KAEVAND,5 Oct 2023 •  8 min read,5 OCT 2023 
"What Is Email Blacklisting, and How Can You Avoid It?",https://instantly.ai/blog/what-is-email-blacklisting,https://instantly.foomonk.com/content/images/2023/10/what-is-email-blacklisting-2.jpg,COLD EMAIL,What is email blacklisting? It’s certainly not something you want your email accounts to be associated with. This is how to avoid it. ,https://instantly.foomonk.com/content/images/2022/05/Screenshot-2022-05-25-at-10.19.19.png,https://instantly.ai/blog/author/raul,RAUL KAEVAND,5 Oct 2023 •  4 min read,5 OCT 2023 
Get More Replies with These 5 Follow-Up Email Software Tools,https://instantly.ai/blog/follow-up-email-software,https://instantly.foomonk.com/content/images/2023/10/follow-up-email-software.jpg,COLD EMAIL,Follow-up email software is a serious game changer for your sales process. No more missed opportunities. Better conversion rates. You just need the right one.,https://instantly.foomonk.com/content/images/2022/05/Screenshot-2022-05-25-at-10.19.19.png,https://instantly.ai/blog/author/raul,RAUL KAEVAND,5 Oct 2023 •  7 min read,5 OCT 2023 
Effective Outreach Through The Art Of BASHO Email,https://instantly.ai/blog/basho-email,https://instantly.foomonk.com/content/images/2023/10/basho-email.jpg,,"A BASHO email is an effective method of writing that captivates attention, respects the recipient’s time, and yields positive responses. ",https://instantly.foomonk.com/content/images/2022/05/Screenshot-2022-05-25-at-10.19.19.png,https://instantly.ai/blog/author/raul,RAUL KAEVAND,3 Oct 2023 •  4 min read,3 OCT 2023 
How To Address A CEO In A Cold Email,https://instantly.ai/blog/how-to-address-a-ceo-in-a-email,https://instantly.foomonk.com/content/images/2023/10/how-to-address-a-ceo.jpg,COLD EMAIL,"How you address a CEO sets the tone for the entire email. Do it wrong, and it could get you flagged as spam. Here are some considerations. ",https://instantly.foomonk.com/content/images/2022/05/Screenshot-2022-05-25-at-10.19.19.png,https://instantly.ai/blog/author/raul,RAUL KAEVAND,3 Oct 2023 •  5 min read,3 OCT 2023 
How to Avoid the Gmail Promotions Tab with Email Warmup,https://instantly.ai/blog/gmail-promotions,https://instantly.foomonk.com/content/images/2023/10/gmail-promotions.jpg,,The best way to avoid the Gmail Promotions tab is to use email warmup to improve your sending accounts' health consistently. Here’s how you do it. ,https://instantly.foomonk.com/content/images/2022/05/Screenshot-2022-05-25-at-10.19.19.png,https://instantly.ai/blog/author/raul,RAUL KAEVAND,3 Oct 2023 •  5 min read,3 OCT 2023 
Sales Cadence Tools for Better Business Communications,https://instantly.ai/blog/sales-cadence-tools,https://instantly.foomonk.com/content/images/2023/10/sales-cadence-tools-1.jpg,,Sales cadence tools help automate sales follow-up and remove the guesswork of when to send an email. Here are the cadence tools we recommend. ,https://instantly.foomonk.com/content/images/2022/05/Screenshot-2022-05-25-at-10.19.19.png,https://instantly.ai/blog/author/raul,RAUL KAEVAND,3 Oct 2023 •  5 min read,3 OCT 2023 
Fundamental Email Marketing Terms From A to Z,https://instantly.ai/blog/email-marketing-terms,https://instantly.foomonk.com/content/images/2023/09/email-marketing-terms.jpg,,Learn these 15 fundamental email marketing terms to enhance your email campaigns with in-depth knowledge. ,https://instantly.foomonk.com/content/images/2022/05/Screenshot-2022-05-25-at-10.19.19.png,https://instantly.ai/blog/author/raul,RAUL KAEVAND,28 Sep 2023 •  5 min read,28 SEP 2023 
Outbound Lead Generation: Proven Strategies for Success,https://instantly.ai/blog/outbound-lead-generation,https://instantly.foomonk.com/content/images/2023/09/outbound-lead-generation.jpg,,Understanding the best approach to outbound lead generation is the first step. Here's how to kickstart your outreach efforts with confidence and finesse. ,https://instantly.foomonk.com/content/images/2022/05/Screenshot-2022-05-25-at-10.19.19.png,https://instantly.ai/blog/author/raul,RAUL KAEVAND,28 Sep 2023 •  6 min read,28 SEP 2023 
ChatGPT Email Prompts To Write Personalized Copy At Scale,https://instantly.ai/blog/chatgpt-email,https://instantly.foomonk.com/content/images/2023/09/chatgpt-emails.jpg,,Using ChatGPT email prompts to write at scale saves you countless hours of personalization and tailoring. Here are the prompts you need to try out. ,https://instantly.foomonk.com/content/images/2022/05/Screenshot-2022-05-25-at-10.19.19.png,https://instantly.ai/blog/author/raul,RAUL KAEVAND,27 Sep 2023 •  7 min read,27 SEP 2023 
Strategic Lead Generation For Software Companies,https://instantly.ai/blog/strategic-lead-generation,https://instantly.foomonk.com/content/images/2023/09/strategic-lead-generation.jpg,COLD EMAIL," Lead generation for software companies is a collection of strategies that includes a variety of techniques, including email, SEO, and social media.",https://instantly.foomonk.com/content/images/2022/05/Screenshot-2022-05-25-at-10.19.19.png,https://instantly.ai/blog/author/raul,RAUL KAEVAND,27 Sep 2023 •  6 min read,27 SEP 2023 
The Best Time To Send Emails For Maximum Engagement,https://instantly.ai/blog/best-time-to-send-emails,https://instantly.foomonk.com/content/images/2023/09/best-time-to-send-emails-1.jpg,COLD EMAIL,"Find the best time to send emails, and you’ll notice that your open rates increase and your engagement soars—your KPIs and readers will thank you.",https://instantly.foomonk.com/content/images/2022/05/Screenshot-2022-05-25-at-10.19.19.png,https://instantly.ai/blog/author/raul,RAUL KAEVAND,27 Sep 2023 •  6 min read,27 SEP 2023 
Marketing Agency Tools: Must-Haves From Engagement to Email,https://instantly.ai/blog/marketing-agency-tools,https://instantly.foomonk.com/content/images/2023/09/marketing-agency-tools.jpg,,Marketing agency tools enable your team to be more productive and efficient with their tasks. Here are the tools worth looking into for each marketing discipline.,https://instantly.foomonk.com/content/images/2022/05/Screenshot-2022-05-25-at-10.19.19.png,https://instantly.ai/blog/author/raul,RAUL KAEVAND,27 Sep 2023 •  7 min read,27 SEP 2023 
12 Email Sequencing Software That Can Help Close Deals,https://instantly.ai/blog/email-sequencing-software,https://instantly.foomonk.com/content/images/2023/09/email-sequencing-software.jpg,COLD EMAIL,Email sequencing software automatically lets your team send personalized and dynamic follow-ups based on prospect behavior. Here are 12 tools to look into. ,https://instantly.foomonk.com/content/images/2022/05/Screenshot-2022-05-25-at-10.19.19.png,https://instantly.ai/blog/author/raul,RAUL KAEVAND,27 Sep 2023 •  10 min read,27 SEP 2023 
How To Send Cold Emails + 5 Templates That Get Replies,https://instantly.ai/blog/how-to-send-cold-emails,https://instantly.foomonk.com/content/images/2023/09/how-to-send-cold-emails.jpg,COLD EMAIL,Learning how to send cold emails helps businesses scale faster than traditional inbound marketing strategies. Here’s a step-by-step guide. ,https://instantly.foomonk.com/content/images/2022/05/Screenshot-2022-05-25-at-10.19.19.png,https://instantly.ai/blog/author/raul,RAUL KAEVAND,27 Sep 2023 •  9 min read,27 SEP 2023 
7 Sales Closing Techniques For Revenue Growth,https://instantly.ai/blog/sales-closing-techniques,https://instantly.foomonk.com/content/images/2023/09/sales-closing-techniques.jpg,,"Closing a sale is the final step in any sales process. Via email, try closing techniques like using visuals, providing immediate value, and leveraging opportunity costs.",https://instantly.foomonk.com/content/images/2022/05/Screenshot-2022-05-25-at-10.19.19.png,https://instantly.ai/blog/author/raul,RAUL KAEVAND,11 Sep 2023 •  5 min read,11 SEP 2023 
12 Outbound Sales Software Worth Looking Into This Year,https://instantly.ai/blog/outbound-sales-software,https://instantly.foomonk.com/content/images/2023/09/shutterstock_1904082286.jpg,COLD EMAIL,"Outbound sales software enables your team to engage with high-value prospects, manage pipelines, and close deals at scale. Here are 12 tools we recommend. ",https://instantly.foomonk.com/content/images/2022/05/Screenshot-2022-05-25-at-10.19.19.png,https://instantly.ai/blog/author/raul,RAUL KAEVAND,11 Sep 2023 •  9 min read,11 SEP 2023 
Time and Productivity: The Necessity of Email Scheduling Software,https://instantly.ai/blog/email-scheduling-software,https://instantly.foomonk.com/content/images/2023/09/email-scheduling.jpg,COLD EMAIL,Email scheduling should be a mandatory part of your day-to-day so you work as efficiently as possible. Here's why. ,https://instantly.foomonk.com/content/images/2022/05/Screenshot-2022-05-25-at-10.19.19.png,https://instantly.ai/blog/author/raul,RAUL KAEVAND,11 Sep 2023 •  8 min read,11 SEP 2023 
10 Email Deliverability Solutions That Deliver Results,https://instantly.ai/blog/email-deliverability-solutions,https://instantly.foomonk.com/content/images/2023/09/shutterstock_2168691047.jpg,COLD EMAIL,These email deliverability solutions ensure that your business emails and cold email campaigns reach your recipient’s inboxes safely time after time.,https://instantly.foomonk.com/content/images/2022/05/Screenshot-2022-05-25-at-10.19.19.png,https://instantly.ai/blog/author/raul,RAUL KAEVAND,8 Sep 2023 •  6 min read,8 SEP 2023 
Sales Forecasting Software: Top 7 Picks of 2023,https://instantly.ai/blog/sales-forecasting-software,https://instantly.foomonk.com/content/images/2023/09/sales-forcasting-software.jpg,,The right sales forecasting software tailored to your business helps set realistic goals and streamline prospecting. Here are the tools you should consider.,https://instantly.foomonk.com/content/images/2022/05/Screenshot-2022-05-25-at-10.19.19.png,https://instantly.ai/blog/author/raul,RAUL KAEVAND,7 Sep 2023 •  7 min read,7 SEP 2023 
Everything You Need To Know About Sales Forecasting,https://instantly.ai/blog/sales-forecasting,https://instantly.foomonk.com/content/images/2023/09/sales-forcasting.jpg,,"Sales forecasting methods like opportunity, historical, and multivariable forecasting enable businesses to improve their sales process. Here’s what you need to know.",https://instantly.foomonk.com/content/images/2022/05/Screenshot-2022-05-25-at-10.19.19.png,https://instantly.ai/blog/author/raul,RAUL KAEVAND,7 Sep 2023 •  9 min read,7 SEP 2023 
Email Salutations: From Casual to Formal and Everything In Between,https://instantly.ai/blog/email-salutations,https://instantly.foomonk.com/content/images/2023/09/email-salutations.jpg,,"How do you know the best email salutation to use? It’s a minefield of hierarchy, personal connection, and cultural differences. Our guide clears it up for you.",https://instantly.foomonk.com/content/images/2022/05/Screenshot-2022-05-25-at-10.19.19.png,https://instantly.ai/blog/author/raul,RAUL KAEVAND,6 Sep 2023 •  6 min read,6 SEP 2023 
Email Scraper Tools For Sustaining Healthy Sales Pipelines,https://instantly.ai/blog/email-scraper,https://instantly.foomonk.com/content/images/2023/09/email-scraper-tools.jpg,COLD EMAIL,An email scraper extracts a lead’s email from a website and keeps it in a database for you to validate and qualify. Here are some tools you should look into.,https://instantly.foomonk.com/content/images/2022/05/Screenshot-2022-05-25-at-10.19.19.png,https://instantly.ai/blog/author/raul,RAUL KAEVAND,6 Sep 2023 •  9 min read,6 SEP 2023 
Best Regards Vs. Kind Regards: Which Is Better For Email Sign-offs?,https://instantly.ai/blog/best-regards-vs-kind-regards,https://instantly.foomonk.com/content/images/2023/09/best-regards-vs-kind-regards.jpg,,Choosing between “best” and “kind” depends on your relationship with the recipient. Not sure which to use? Here’s what we think. ,https://instantly.foomonk.com/content/images/2022/05/Screenshot-2022-05-25-at-10.19.19.png,https://instantly.ai/blog/author/raul,RAUL KAEVAND,5 Sep 2023 •  4 min read,5 SEP 2023 
Best Email Tracking Tools For Business Growth,https://instantly.ai/blog/email-tracking,https://instantly.foomonk.com/content/images/2023/09/email-tracking.jpg,COLD EMAIL,"Email tracking tools analyze the behaviors of our leads, helping us improve prospecting, follow-ups, and personalization. Here’s what we recommend. ",https://instantly.foomonk.com/content/images/2022/05/Screenshot-2022-05-25-at-10.19.19.png,https://instantly.ai/blog/author/raul,RAUL KAEVAND,5 Sep 2023 •  9 min read,5 SEP 2023 
Sales Enablement Strategies You Need To Know in 2023,https://instantly.ai/blog/sales-enablement,https://instantly.foomonk.com/content/images/2023/08/sales-enablement-strategies.jpg,,"Sales enablement equips your team with the necessary resources and tools to optimize tasks, streamline sales processes, and become more productive. ",https://instantly.foomonk.com/content/images/2022/05/Screenshot-2022-05-25-at-10.19.19.png,https://instantly.ai/blog/author/raul,RAUL KAEVAND,28 Aug 2023 •  8 min read,28 AUG 2023 
An Infallible Guide to Startup Sales Strategy,https://instantly.ai/blog/startup-sales-strategy,https://instantly.foomonk.com/content/images/2023/08/startup-sales-strategy.jpg,,"Startups need sales strategies like cold sales, market differentiators, inbound marketing, and MEDDIC to penetrate, succeed, and thrive in saturated markets.",https://instantly.foomonk.com/content/images/2022/05/Screenshot-2022-05-25-at-10.19.19.png,https://instantly.ai/blog/author/raul,RAUL KAEVAND,28 Aug 2023 •  9 min read,28 AUG 2023 
The Top 4 Sales Enablement Tools in 2023,https://instantly.ai/blog/sales-enablement-tools,https://instantly.foomonk.com/content/images/2023/08/sales-enablement-tools-4.jpg,,Empower your sales team and create effective engagement channels. These are our choice of the best sales enablement tools that you can use in 2023. ,https://instantly.foomonk.com/content/images/2022/05/Screenshot-2022-05-25-at-10.19.19.png,https://instantly.ai/blog/author/raul,RAUL KAEVAND,23 Aug 2023 •  8 min read,23 AUG 2023 
Sales Funnel Templates: The Key To Unlocking Sales Success,https://instantly.ai/blog/sales-funnel-templates,https://instantly.foomonk.com/content/images/2023/08/sales-funnel-templates.jpg,,Using a sales funnel template is a great way to guarantee your sales funnel has a solid foundation for you to build on. It’s an effective way to get started.,https://instantly.foomonk.com/content/images/2022/05/Screenshot-2022-05-25-at-10.19.19.png,https://instantly.ai/blog/author/raul,RAUL KAEVAND,23 Aug 2023 •  9 min read,23 AUG 2023 
Inbound Sales Process From Qualification To Closing,https://instantly.ai/blog/inbound-sales,https://instantly.foomonk.com/content/images/2023/08/inbound-sales.jpg,,Inbound sales helps you generate high-quality leads already showing interest in your products. Here’s what you can do to ensure these leads convert into sales.,https://instantly.foomonk.com/content/images/2022/05/Screenshot-2022-05-25-at-10.19.19.png,https://instantly.ai/blog/author/raul,RAUL KAEVAND,21 Aug 2023 •  9 min read,21 AUG 2023 
Closing Deals: The Fundamentals of Sales Negotiation,https://instantly.ai/blog/sales-negotiation,https://instantly.foomonk.com/content/images/2023/08/sales-negotiation.jpg,,"To close more deals consistently, try sales negotiation strategies such as emphasizing losses, combining gains, and avoiding ranges. Here’s an in-depth look. ",https://instantly.foomonk.com/content/images/2022/05/Screenshot-2022-05-25-at-10.19.19.png,https://instantly.ai/blog/author/raul,RAUL KAEVAND,21 Aug 2023 •  7 min read,21 AUG 2023 
Streamline Lead Qualification With This Checklist,https://instantly.ai/blog/lead-qualification-checklist,https://instantly.foomonk.com/content/images/2023/08/lead-qualification-checklist.jpg,COLD EMAIL,A lead qualification checklist is an outline that your team can use to find sales-ready prospects. Here’s how you build a checklist tailored to your business.,https://instantly.foomonk.com/content/images/2022/05/Screenshot-2022-05-25-at-10.19.19.png,https://instantly.ai/blog/author/raul,RAUL KAEVAND,10 Aug 2023 •  5 min read,10 AUG 2023 
Here’s How To Test Email Deliverability,https://instantly.ai/blog/test-email-deliverability,https://instantly.foomonk.com/content/images/2023/08/test-email-deliverability--3-.jpg,COLD EMAIL,Knowing how to test email deliverability means that you’ll be able to ensure your carefully crafted outreach campaigns hit the recipient’s inbox.,https://instantly.foomonk.com/content/images/2022/05/Screenshot-2022-05-25-at-10.19.19.png,https://instantly.ai/blog/author/raul,RAUL KAEVAND,10 Aug 2023 •  6 min read,10 AUG 2023 
Driving Sales With Next Level Lead Nurturing Software,https://instantly.ai/blog/lead-nurturing-software,https://instantly.foomonk.com/content/images/2023/08/lead-nurturing-software.jpg,COLD EMAIL,Choosing the right lead nurturing software can take your connection to your audience to another level. Deeper relationships lead to easier conversions.,https://instantly.foomonk.com/content/images/2022/05/Screenshot-2022-05-25-at-10.19.19.png,https://instantly.ai/blog/author/raul,RAUL KAEVAND,10 Aug 2023 •  6 min read,10 AUG 2023 
Boosting Cold Email Conversions With Sales Psychology,https://instantly.ai/blog/sales-psychology,https://instantly.foomonk.com/content/images/2023/08/sales-psychology.jpg,COLD EMAIL,"Sales psychology principles, like social proof, authority, and scarcity, significantly boost conversions in cold email campaigns. Here’s what you need to know.",https://instantly.foomonk.com/content/images/2022/05/Screenshot-2022-05-25-at-10.19.19.png,https://instantly.ai/blog/author/raul,RAUL KAEVAND,10 Aug 2023 •  7 min read,10 AUG 2023 
Communication Strategy: Captivate and Engage Your Audience,https://instantly.ai/blog/communication-strategy,https://instantly.foomonk.com/content/images/2023/08/communication-strategy.jpg,,"Every business has a communication strategy, even if it isn’t formally documented. Having a clear understanding of it helps you connect to your audience.",https://instantly.foomonk.com/content/images/2022/05/Screenshot-2022-05-25-at-10.19.19.png,https://instantly.ai/blog/author/raul,RAUL KAEVAND,10 Aug 2023 •  7 min read,10 AUG 2023 
