Title,Title_URL,Image,Tag,Field,Avatar,Content,Content1,postcardbylinedate,postcardbylinedate2
Email Bounced Back? Here's Why.,https://instantly.ai/blog/email-bounced-back,https://instantly.foomonk.com/content/images/2023/08/email-bounced-back.jpg,COLD EMAIL,"If an email bounces back, identify whether it's a soft or a hard bounce. From there, you can start troubleshooting to fix the issue. Here’s how. ",https://instantly.foomonk.com/content/images/2022/05/Screenshot-2022-05-25-at-10.19.19.png,https://instantly.ai/blog/author/raul,RAUL KAEVAND,2 Aug 2023 •  5 min read,2 AUG 2023 
10 Best Email Sign-Offs That Are Anything But Boring,https://instantly.ai/blog/best-email-sign-offs,https://instantly.foomonk.com/content/images/2023/08/email-signoffs.jpg,COLD EMAIL,"While email sign-off may seem like only a formality, they play a role in the overall tone of the message you're sending. Here are a few fresh ideas. ",https://instantly.foomonk.com/content/images/2022/05/Screenshot-2022-05-25-at-10.19.19.png,https://instantly.ai/blog/author/raul,RAUL KAEVAND,2 Aug 2023 •  7 min read,2 AUG 2023 
Defrosting Inboxes With Email Icebreakers,https://instantly.ai/blog/email-icebreakers,https://instantly.foomonk.com/content/images/2023/08/email-icebreakers.jpg,COLD EMAIL,"Email icebreakers are more than just introductions. They’re the key to transforming cold leads into warm conversations. We share examples and tips, ready to use.",https://instantly.foomonk.com/content/images/2022/05/Screenshot-2022-05-25-at-10.19.19.png,https://instantly.ai/blog/author/raul,RAUL KAEVAND,2 Aug 2023 •  4 min read,2 AUG 2023 
Business Communication 101: How to Format an Email,https://instantly.ai/blog/how-to-format-an-email,https://instantly.foomonk.com/content/images/2023/08/how-to-format-an-email.jpg,COLD EMAIL,Formatting in writing determines how information is read and received. Here's how to format an email properly to make sure recipients get the message.,https://instantly.foomonk.com/content/images/2022/05/Screenshot-2022-05-25-at-10.19.19.png,https://instantly.ai/blog/author/raul,RAUL KAEVAND,1 Aug 2023 •  7 min read,1 AUG 2023 
7 High-Converting Business Email Templates,https://instantly.ai/blog/business-email-templates,https://instantly.foomonk.com/content/images/2023/08/business-email-templates.jpg,COLD EMAIL,Streamline email campaigns faster with a business email template. Here are seven curated templates optimized for conversions—steal them now!,https://instantly.foomonk.com/content/images/2022/05/Screenshot-2022-05-25-at-10.19.19.png,https://instantly.ai/blog/author/raul,RAUL KAEVAND,1 Aug 2023 •  6 min read,1 AUG 2023 
Sales Follow-up Email Templates Built To Convert,https://instantly.ai/blog/sales-follow-up-email,https://instantly.foomonk.com/content/images/2023/08/sales-follow-up-email.jpg,COLD EMAIL,"Typically, sales aren’t closed after first-touch communications. Here are 5 templates for your next sales follow-up email.  ",https://instantly.foomonk.com/content/images/2022/05/Screenshot-2022-05-25-at-10.19.19.png,https://instantly.ai/blog/author/raul,RAUL KAEVAND,1 Aug 2023 •  7 min read,1 AUG 2023 
Developing Growth Strategies Starts with a Solid Foundation,https://instantly.ai/blog/growth-strategies,https://instantly.foomonk.com/content/images/2023/08/developing-growth-strategies.jpg,,"Growth strategies help you grow sustainably. The fundamentals of these strategies include penetration, expansion, diversification, and acquisition. ",https://instantly.foomonk.com/content/images/2022/05/Screenshot-2022-05-25-at-10.19.19.png,https://instantly.ai/blog/author/raul,RAUL KAEVAND,1 Aug 2023 •  9 min read,1 AUG 2023 
Writing Collaboration Emails And Partnership Proposals,https://instantly.ai/blog/collaboration-emails,https://instantly.foomonk.com/content/images/2023/07/collaboration-email.jpg,COLD EMAIL,"Building partnerships is a major part of business. There's a lot involved, but it all starts with you sending a collaboration email proposing a connection. ",https://instantly.foomonk.com/content/images/2022/05/Screenshot-2022-05-25-at-10.19.19.png,https://instantly.ai/blog/author/raul,RAUL KAEVAND,31 Jul 2023 •  8 min read,31 JUL 2023 
Elevator Pitch Templates That Take You To The Top,https://instantly.ai/blog/elevator-pitch-templates,https://instantly.foomonk.com/content/images/2023/07/elevator-pitch-templates.jpg,COLD EMAIL,An elevator pitch is a powerful tool that can convert leads into customers without all the fuzz. Here’s how you make it work. ,https://instantly.foomonk.com/content/images/2022/05/Screenshot-2022-05-25-at-10.19.19.png,https://instantly.ai/blog/author/raul,RAUL KAEVAND,31 Jul 2023 •  11 min read,31 JUL 2023 
The 7 Best Apollo Alternatives of 2023,https://instantly.ai/blog/apollo-alternatives,https://instantly.foomonk.com/content/images/2023/07/apollo-alternative.jpg,COLD EMAIL,"Maybe you’ve tried it, and now you’re looking for a set of Apollo alternatives, if so this is the list for you. Here are the 7 best email finders on the market. ",https://instantly.foomonk.com/content/images/2022/05/Screenshot-2022-05-25-at-10.19.19.png,https://instantly.ai/blog/author/raul,RAUL KAEVAND,31 Jul 2023 •  9 min read,31 JUL 2023 
How to Create an Irresistible Offer and Maximize Email Responses,https://instantly.ai/blog/how-to-create-an-irresistible-offer,https://instantly.foomonk.com/content/images/2023/07/how-to-create-an-irresistable-offerf-3.jpg,COLD EMAIL,"Discover how to create an irresistible offer for your cold email campaigns. Learn about urgency, scarcity, clarity, trust, and risk minimization.",https://instantly.foomonk.com/content/images/2022/05/Screenshot-2022-05-25-at-10.19.19.png,https://instantly.ai/blog/author/raul,RAUL KAEVAND,31 Jul 2023 •  5 min read,31 JUL 2023 
Understanding The MEDDIC Sales Methodology For Qualification,https://instantly.ai/blog/meddic-sales-methodology,https://instantly.foomonk.com/content/images/2023/07/meddic-sales-methodology.jpg,,"Getting to grips with the MEDDIC sales methodology is a great way to cement your lead qualification if you want greater efficiency and increased profits.
",https://instantly.foomonk.com/content/images/2022/05/Screenshot-2022-05-25-at-10.19.19.png,https://instantly.ai/blog/author/raul,RAUL KAEVAND,31 Jul 2023 •  6 min read,31 JUL 2023 
The 7 Best Hunter Alternatives of 2023,https://instantly.ai/blog/hunter-alternatives,https://instantly.foomonk.com/content/images/2023/07/hunter-alternatives.jpg,COLD EMAIL,Here are our Top 7 Hunter alternatives. Check out the features list to be sure you're getting the most out of your email finder tools. ,https://instantly.foomonk.com/content/images/2022/05/Screenshot-2022-05-25-at-10.19.19.png,https://instantly.ai/blog/author/raul,RAUL KAEVAND,28 Jul 2023 •  8 min read,28 JUL 2023 
The Rolodex Revolution: Upgrading to a B2B Lead Database,https://instantly.ai/blog/b2b-lead-database,https://instantly.foomonk.com/content/images/2023/07/b2b-lead-database.jpg,COLD EMAIL,Step up your B2B sales strategy with our guide on B2B lead databases. We share everything from creation to choosing the right option for your needs.,https://instantly.foomonk.com/content/images/2022/05/Screenshot-2022-05-25-at-10.19.19.png,https://instantly.ai/blog/author/raul,RAUL KAEVAND,10 Jul 2023 •  6 min read,10 JUL 2023 
From Inbox To Interaction: Write A Cold Email To A Potential Client,https://instantly.ai/blog/cold-email-to-a-potential-client,https://instantly.foomonk.com/content/images/2023/07/cold-email-to-potential-client.jpg,,"Learn how a well-crafted cold email to a potential client can turn them from just another prospect into a promising business partner.
",https://instantly.foomonk.com/content/images/2022/05/Screenshot-2022-05-25-at-10.19.19.png,https://instantly.ai/blog/author/raul,RAUL KAEVAND,10 Jul 2023 •  6 min read,10 JUL 2023 
How to Qualify a Sales Lead Using BANT,https://instantly.ai/blog/how-to-qualify-a-sales-lead,https://instantly.foomonk.com/content/images/2023/07/how-to-qualify-sales-leads.jpg,,"To increase conversions, you need to know how to qualify sales leads. In this article, we chat about the straightforward and fast approach—BANT",https://instantly.foomonk.com/content/images/2022/05/Screenshot-2022-05-25-at-10.19.19.png,https://instantly.ai/blog/author/raul,RAUL KAEVAND,6 Jul 2023 •  5 min read,6 JUL 2023 
No More Awkward Pauses: Conversation Starters For Emails,https://instantly.ai/blog/conversation-starters,https://instantly.foomonk.com/content/images/2023/07/conversation-starters--2-.jpg,COLD EMAIL,Conversation starters are as important in cold emails as they are in real life. It’s a chance to captivate your recipient and begin a meaningful relationship.,https://instantly.foomonk.com/content/images/2022/05/Screenshot-2022-05-25-at-10.19.19.png,https://instantly.ai/blog/author/raul,RAUL KAEVAND,6 Jul 2023 •  8 min read,6 JUL 2023 
The B2B Sales Funnel: Pioneering Pathways to Profit,https://instantly.ai/blog/b2b-sales-funnel,https://instantly.foomonk.com/content/images/2023/07/b2b-sales-funnel.jpg,,"Ready to harness the transformative power of a B2B sales funnel? We share the core stages, benefits, and how you can implement your own in simple steps.",https://instantly.foomonk.com/content/images/2022/05/Screenshot-2022-05-25-at-10.19.19.png,https://instantly.ai/blog/author/raul,RAUL KAEVAND,3 Jul 2023 •  7 min read,3 JUL 2023 
How To Find Email Addresses 9 Manual Methods + 4 Pro Tools,https://instantly.ai/blog/how-to-find-email-addresses,https://instantly.foomonk.com/content/images/2023/07/how-to-find-email-addresses.jpg,COLD EMAIL,Sending an email to contact@ isn’t always going to cut it. You need to know how to find the right email to get your message to the right person.,https://instantly.foomonk.com/content/images/2022/05/Screenshot-2022-05-25-at-10.19.19.png,https://instantly.ai/blog/author/raul,RAUL KAEVAND,3 Jul 2023 •  8 min read,3 JUL 2023 
How to Create Dynamic Sales Prospecting Strategies,https://instantly.ai/blog/sales-prospecting,https://instantly.foomonk.com/content/images/2023/06/sales-prospecting.jpg,,"A dynamic sales prospecting strategy allows your sales development representatives to focus on the right leads, saving time and resources.  ",https://instantly.foomonk.com/content/images/2022/05/Screenshot-2022-05-25-at-10.19.19.png,https://instantly.ai/blog/author/raul,RAUL KAEVAND,30 Jun 2023 •  8 min read,30 JUN 2023 
How To Develop a Versatile Sales Strategy,https://instantly.ai/blog/sales-strategy,https://instantly.foomonk.com/content/images/2023/06/sales-strategy--3-.jpg,,"A sales strategy needs a defined goal, qualified leads, and optimized sales pipelines. Here’s everything you need to know. 
",https://instantly.foomonk.com/content/images/2022/05/Screenshot-2022-05-25-at-10.19.19.png,https://instantly.ai/blog/author/raul,RAUL KAEVAND,30 Jun 2023 •  6 min read,30 JUN 2023 
Creating A Conversion Powerhouse: 9 Sales Strategy Examples,https://instantly.ai/blog/sales-strategy-examples,https://instantly.foomonk.com/content/images/2023/06/sales-strategy-examples.jpg,,"Discover the secret to success with these 9 proven sales strategy examples. Learn how to build a robust, sustainable sales system for growth and development.",https://instantly.foomonk.com/content/images/2022/05/Screenshot-2022-05-25-at-10.19.19.png,https://instantly.ai/blog/author/raul,RAUL KAEVAND,30 Jun 2023 •  9 min read,30 JUN 2023 
Transforming No into Yes: Handling Objections for Improved Sales,https://instantly.ai/blog/handling-objections,https://instantly.foomonk.com/content/images/2023/06/handling-ojections.jpg,COLD EMAIL,Handling objections is your secret sales weapon. Unleash the power to convert a 'no' into a 'yes absolutely' and redefine your sales paradigm.,https://instantly.foomonk.com/content/images/2022/05/Screenshot-2022-05-25-at-10.19.19.png,https://instantly.ai/blog/author/raul,RAUL KAEVAND,29 Jun 2023 •  10 min read,29 JUN 2023 
How to Create High-Conversion Sales Video Letters,https://instantly.ai/blog/sales-video-letters,https://instantly.foomonk.com/content/images/2023/06/sales-video-letter.png,,Using sales video letters is an underrated strategy with a high conversion rate. Here’s everything you need to make the best out of this strategy. ,https://instantly.foomonk.com/content/images/2022/05/Screenshot-2022-05-25-at-10.19.19.png,https://instantly.ai/blog/author/raul,RAUL KAEVAND,29 Jun 2023 •  5 min read,29 JUN 2023 
Leveraging Cold Emails To Get High-Quality Agency Leads Consistently,https://instantly.ai/blog/agency-leads,https://instantly.foomonk.com/content/images/2023/06/agency-leads.png,COLD EMAIL,"Sales success is directly related to lead quality.  And, the best way to get and qualify quality agency leads is through cold email campaigns. 
",https://instantly.foomonk.com/content/images/2022/05/Screenshot-2022-05-25-at-10.19.19.png,https://instantly.ai/blog/author/raul,RAUL KAEVAND,29 Jun 2023 •  7 min read,29 JUN 2023 
Elevate Your Pitch with 6 Cold Email Templates for Sales,https://instantly.ai/blog/cold-email-templates-for-sales,https://instantly.foomonk.com/content/images/2023/06/elevator-pitch.jpg,COLD EMAIL,These cold email templates for sales offer inspiration and a foundation to launch your next successful outreach campaign. Steal them and build connections.,https://instantly.foomonk.com/content/images/2022/05/Screenshot-2022-05-25-at-10.19.19.png,https://instantly.ai/blog/author/raul,RAUL KAEVAND,29 Jun 2023 •  8 min read,29 JUN 2023 
The Fastest Lead Generation Strategies For Startups,https://instantly.ai/blog/lead-generation-strategies-for-startups,https://instantly.foomonk.com/content/images/2023/06/startup-lead-generation.jpg,COLD EMAIL,Startups need lead-generation strategies and vehicles to scale and grow. But they also need to learn the common pitfalls to avoid. ,https://instantly.foomonk.com/content/images/2022/05/Screenshot-2022-05-25-at-10.19.19.png,https://instantly.ai/blog/author/raul,RAUL KAEVAND,27 Jun 2023 •  7 min read,27 JUN 2023 
The Only Enterprise Sales Guide You Need Bookmarked,https://instantly.ai/blog/enterprise-sales,https://instantly.foomonk.com/content/images/2023/06/enterprise-sales-guide.jpg,,"With scale comes complexity. To succeed in enterprise sales, you need to develop unique systems, understand risks, and follow best practices. ",https://instantly.foomonk.com/content/images/2022/05/Screenshot-2022-05-25-at-10.19.19.png,https://instantly.ai/blog/author/raul,RAUL KAEVAND,27 Jun 2023 •  10 min read,27 JUN 2023 
How To Build Rapport in Email Marketing and Create Lasting Relationships,https://instantly.ai/blog/how-to-build-rapport,https://instantly.foomonk.com/content/images/2023/06/how-to-build-rapport.jpg,COLD EMAIL,Learning how to build rapport is important for any business that wants to have a genuine connection with its prospects. Greater rapport means more conversions.,https://instantly.foomonk.com/content/images/2022/05/Screenshot-2022-05-25-at-10.19.19.png,https://instantly.ai/blog/author/raul,RAUL KAEVAND,5 Jun 2023 •  5 min read,5 JUN 2023 
Introduction Email Sample: Connect and Impress with Ease,https://instantly.ai/blog/introduction-email-sample,https://instantly.foomonk.com/content/images/2023/06/introduction-email-sample-1.jpg,COLD EMAIL,Making a first impression counts. Check out these introduction email samples we've created the help you put your best foot forward. ,https://instantly.foomonk.com/content/images/2022/05/Screenshot-2022-05-25-at-10.19.19.png,https://instantly.ai/blog/author/raul,RAUL KAEVAND,5 Jun 2023 •  8 min read,5 JUN 2023 
Memorable Sign-offs: How to End an Email with Impact,https://instantly.ai/blog/how-to-end-an-email,https://instantly.foomonk.com/content/images/2023/06/how-to-close-an-email.jpg,COLD EMAIL,There’s more to closing an email than saying “Many thanks” or “Kind Regards” Here we explore alternative and impactful email endings.,https://instantly.foomonk.com/content/images/2022/05/Screenshot-2022-05-25-at-10.19.19.png,https://instantly.ai/blog/author/raul,RAUL KAEVAND,5 Jun 2023 •  7 min read,5 JUN 2023 
The Complete Guide To Cold Email Prospecting for Sales,https://instantly.ai/blog/cold-email-prospecting-sales,https://instantly.foomonk.com/content/images/2023/06/cold-email-prospecting-sales.jpg,COLD EMAIL,"A definitive cold email prospecting sales strategy can be a lucrative, efficient, and effective way to build a comprehensive pipeline of leads.",https://instantly.foomonk.com/content/images/2022/05/Screenshot-2022-05-25-at-10.19.19.png,https://instantly.ai/blog/author/raul,RAUL KAEVAND,5 Jun 2023 •  9 min read,5 JUN 2023 
13 Powerful Ways To Generate Real Estate Sales Leads,https://instantly.ai/blog/real-estate-sales-leads,https://instantly.foomonk.com/content/images/2023/06/real-estate-sales-leads.jpg,COLD EMAIL,A compilation of the 13 best ways to generate real estate sales leads primed to launch your business to new levels of growth and lead generation.,https://instantly.foomonk.com/content/images/2022/05/Screenshot-2022-05-25-at-10.19.19.png,https://instantly.ai/blog/author/raul,RAUL KAEVAND,5 Jun 2023 •  4 min read,5 JUN 2023 
The Perfect Cold Email For Internship Applications,https://instantly.ai/blog/cold-email-for-internship,https://instantly.foomonk.com/content/images/2023/06/cold-email-for-internship.jpg,,"If you want to get the most replies and interview invitations out of your cold emails for internships, follow these best practices. ",https://instantly.foomonk.com/content/images/2022/05/Screenshot-2022-05-25-at-10.19.19.png,https://instantly.ai/blog/author/raul,RAUL KAEVAND,1 Jun 2023 •  5 min read,1 JUN 2023 
B2B Lead Generation Strategies for Growing Businesses,https://instantly.ai/blog/b2b-lead-generation-strategies,https://instantly.foomonk.com/content/images/2023/06/b2b-lead-generation-strategies.jpg,COLD EMAIL,"Looking to scale your B2B business? You know you need leads, and that means you need some solid B2B Lead Generation Strategies. Try this.",https://instantly.foomonk.com/content/images/2022/05/Screenshot-2022-05-25-at-10.19.19.png,https://instantly.ai/blog/author/raul,RAUL KAEVAND,1 Jun 2023 •  9 min read,1 JUN 2023 
From Prospect to Customer: Effective Sales Lead Generation Tactics,https://instantly.ai/blog/sales-leads,https://instantly.foomonk.com/content/images/2023/06/sales-lead-generation--2-.jpg,COLD EMAIL,Generating and converting sales leads is crucial to fuel growth and success. Learn how to turn leads into long-time customers with this strategy. ,https://instantly.foomonk.com/content/images/2022/05/Screenshot-2022-05-25-at-10.19.19.png,https://instantly.ai/blog/author/raul,RAUL KAEVAND,1 Jun 2023 •  9 min read,1 JUN 2023 
Creating a Professional Email Signature: Sign Off and Stand Out,https://instantly.ai/blog/professional-email-signature,https://instantly.foomonk.com/content/images/2023/05/professional-email-signature.jpg,COLD EMAIL,"What does your professional email signature say about you? Is it professional, or is it in need of some more attention? We explore tips and tricks to help out.",https://instantly.foomonk.com/content/images/2022/05/Screenshot-2022-05-25-at-10.19.19.png,https://instantly.ai/blog/author/raul,RAUL KAEVAND,30 May 2023 •  9 min read,30 MAY 2023 
Unlocking the Power of Cold Sales: 10 Essential Statistics for Success,https://instantly.ai/blog/cold-sales-statistics,https://instantly.foomonk.com/content/images/2023/05/cold-sales-statistics.jpg,COLD EMAIL,These cold sales statistics provide valuable insight into the strategies you should be employing as part of your larger marketing strategy. ,https://instantly.foomonk.com/content/images/2022/05/Screenshot-2022-05-25-at-10.19.19.png,https://instantly.ai/blog/author/raul,RAUL KAEVAND,30 May 2023 •  4 min read,30 MAY 2023 
How To Integrate Intent Data To Create Solid Sales Strategies,https://instantly.ai/blog/intent-data,https://instantly.foomonk.com/content/images/2023/05/intent-data.jpg,,"Intent data helps us understand what our customers want, the potential weaknesses of our competition, and which leads we need to focus on. ",https://instantly.foomonk.com/content/images/2022/05/Screenshot-2022-05-25-at-10.19.19.png,https://instantly.ai/blog/author/raul,RAUL KAEVAND,30 May 2023 •  4 min read,30 MAY 2023 
How To Write The Perfect Proposal Email,https://instantly.ai/blog/how-to-write-a-proposal-email,https://instantly.foomonk.com/content/images/2023/05/how-to-write-a-proposal-email.jpg,COLD EMAIL,Writing a proposal email helps your brand reach out to prospects and establish an outline of services you can offer. Here’s all you need to know. ,https://instantly.foomonk.com/content/images/2022/05/Screenshot-2022-05-25-at-10.19.19.png,https://instantly.ai/blog/author/raul,RAUL KAEVAND,30 May 2023 •  5 min read,30 MAY 2023 
Sales Cadence: A Systematic Approach To Scaling Your Business,https://instantly.ai/blog/sales-cadence,https://instantly.foomonk.com/content/images/2023/05/sales-cadenece.jpg,COLD EMAIL,Sales cadence helps your business create a systematic approach for effectively communicating with high-value leads and improving conversion rates. ,https://instantly.foomonk.com/content/images/2022/05/Screenshot-2022-05-25-at-10.19.19.png,https://instantly.ai/blog/author/raul,RAUL KAEVAND,30 May 2023 •  5 min read,30 MAY 2023 
The Fundamentals Of A Solid Cold Sales Strategy,https://instantly.ai/blog/cold-sales-strategy,https://instantly.foomonk.com/content/images/2023/05/cold-sales-strategy-3.jpg,COLD EMAIL,Creating a solid cold sales strategy helps your business scale and grow sustainably. Here are 5 sure-fire approaches. ,https://instantly.foomonk.com/content/images/2022/05/Screenshot-2022-05-25-at-10.19.19.png,https://instantly.ai/blog/author/raul,RAUL KAEVAND,29 May 2023 •  9 min read,29 MAY 2023 
Alleviating Pain Points in Sales to Supercharge Conversions,https://instantly.ai/blog/pain-points-in-sales,https://instantly.foomonk.com/content/images/2023/05/sales-pain-points.jpg,COLD EMAIL,Taking the time to reduce or eradicate pain points in sales can be a game changer for your business. Happier teams result in higher conversions and satisfied customers.,https://instantly.foomonk.com/content/images/2022/05/Screenshot-2022-05-25-at-10.19.19.png,https://instantly.ai/blog/author/raul,RAUL KAEVAND,29 May 2023 •  8 min read,29 MAY 2023 
How to Find Leads: Exploring Every Avenue for Success,https://instantly.ai/blog/how-to-find-leads,https://instantly.foomonk.com/content/images/2023/05/how-to-find-leads.jpg,COLD EMAIL,Learning how to find and nurture leads is essential for business success. Here we explore the most effective avenues of lead generation. ,https://instantly.foomonk.com/content/images/2022/05/Screenshot-2022-05-25-at-10.19.19.png,https://instantly.ai/blog/author/raul,RAUL KAEVAND,29 May 2023 •  8 min read,29 MAY 2023 
"#1 Cold Sales Guide: Strategy, Hacks, And Email Mastery",https://instantly.ai/blog/cold-sales,https://instantly.foomonk.com/content/images/2023/05/cold-sales.jpg,COLD EMAIL,"This is the ultimate cold sales guide. We cover everything from definitions to obstacles, techniques to channels, plus how to leverage the power of cold email.",https://instantly.foomonk.com/content/images/2022/05/Screenshot-2022-05-25-at-10.19.19.png,https://instantly.ai/blog/author/raul,RAUL KAEVAND,29 May 2023 •  12 min read,29 MAY 2023 
Creating Holistic Lead Sourcing Strategies For Any Business,https://instantly.ai/blog/lead-sourcing,https://instantly.foomonk.com/content/images/2023/05/lead-sourcing.jpg,COLD EMAIL,"Growing your business means following routine, measurable, and streamlined strategies for lead sourcing. Here’s what you need to know. ",https://instantly.foomonk.com/content/images/2022/05/Screenshot-2022-05-25-at-10.19.19.png,https://instantly.ai/blog/author/raul,RAUL KAEVAND,29 May 2023 •  6 min read,29 MAY 2023 
Developing A Successful Influencer Marketing Campaign,https://instantly.ai/blog/influencer-marketing-campaign,https://instantly.foomonk.com/content/images/2023/05/influencer-marketing-campaign-1.jpg,,Influencer marketing is great for increasing engagement and brand awareness. Learn how to create a successful influencer marketing campaign.,https://instantly.foomonk.com/content/images/2022/05/Screenshot-2022-05-25-at-10.19.19.png,https://instantly.ai/blog/author/raul,RAUL KAEVAND,3 May 2023 •  5 min read,3 MAY 2023 
How To Write An Internship Cold Email That Gets Interviews,https://instantly.ai/blog/internship-cold-email,https://instantly.foomonk.com/content/images/2023/05/internship-cold-email.jpg,COLD EMAIL,"Wondering where to start with your attempt at an internship cold email? You’re not alone, that’s why we’ve created a process, and even some templates.",https://instantly.foomonk.com/content/images/2022/05/Screenshot-2022-05-25-at-10.19.19.png,https://instantly.ai/blog/author/raul,RAUL KAEVAND,3 May 2023 •  6 min read,3 MAY 2023 
Learn How To Close A Sale Successfully In 7 Steps,https://instantly.ai/blog/how-to-close-a-sale,https://instantly.foomonk.com/content/images/2023/05/how-to-close-a-sale.jpg,,"When you learn how to close a sale you’re not only improving yourself as a salesperson, but you’re building extra revenue for the business and fostering growth.",https://instantly.foomonk.com/content/images/2022/05/Screenshot-2022-05-25-at-10.19.19.png,https://instantly.ai/blog/author/raul,RAUL KAEVAND,3 May 2023 •  5 min read,3 MAY 2023 
