Title,Title_URL,Image,Tag,Field,Avatar,Content,Content1,postcardbylinedate,postcardbylinedate2
The 7 Most Effective Ways Of Nurturing A Lead,https://instantly.ai/blog/nurturing-a-lead,https://instantly.foomonk.com/content/images/2023/05/nurturing-a-lead.jpg,,"Effectively nurturing a lead is like rocket fuel for your business. It takes potentially missed prospects and turns them into converted, revenue-driving sales.",https://instantly.foomonk.com/content/images/2022/05/Screenshot-2022-05-25-at-10.19.19.png,https://instantly.ai/blog/author/raul,RAUL KAEVAND,3 May 2023 •  5 min read,3 MAY 2023 
What Is A Lead Funnel And Why Does Your Business Need One?,https://instantly.ai/blog/lead-funnel,https://instantly.foomonk.com/content/images/2023/05/lead-funnel.jpg,,Learning what a lead funnel is should be an essential part of any growing business. Implementing one could make all of the difference to your bottom line.,https://instantly.foomonk.com/content/images/2022/05/Screenshot-2022-05-25-at-10.19.19.png,https://instantly.ai/blog/author/raul,RAUL KAEVAND,3 May 2023 •  5 min read,3 MAY 2023 
7 Effective Cold Sales Email Templates for Better Outreach and Engagement,https://instantly.ai/blog/cold-sales-email-templates,https://instantly.foomonk.com/content/images/2023/05/cold-sales-email-templates.jpg,COLD EMAIL,The same old emails could mean missed conversion opportunities. Here are 7 cold sales email templates to keep your outreach fresh. ,https://instantly.foomonk.com/content/images/2022/05/Screenshot-2022-05-25-at-10.19.19.png,https://instantly.ai/blog/author/raul,RAUL KAEVAND,3 May 2023 •  8 min read,3 MAY 2023 
Learn How To Qualify Sales Leads Like A Pro,https://instantly.ai/blog/learn-how-to-qualify-sales-leads,https://instantly.foomonk.com/content/images/2023/05/how-to-qualify-sales-leads.jpg,,"If you’re looking for a great way to improve your sales metrics and conversion rates, you should learn how to qualify sales leads effectively.",https://instantly.foomonk.com/content/images/2022/05/Screenshot-2022-05-25-at-10.19.19.png,https://instantly.ai/blog/author/raul,RAUL KAEVAND,3 May 2023 •  6 min read,3 MAY 2023 
How To Get Sales Leads For Free: 12 Ways,https://instantly.ai/blog/how-to-get-sales-leads-for-free,https://instantly.foomonk.com/content/images/2023/05/how-to-get-sales-leads-for-free.jpg,,Want to learn how to get sales leads for free? We’ve got you covered with these 12 methods and places to bring them flooding in.,https://instantly.foomonk.com/content/images/2022/05/Screenshot-2022-05-25-at-10.19.19.png,https://instantly.ai/blog/author/raul,RAUL KAEVAND,3 May 2023 •  8 min read,3 MAY 2023 
Sales Funnel: A Definitive Path To Sales And Growth,https://instantly.ai/blog/sales-funnel,https://instantly.foomonk.com/content/images/2023/05/sales-funnel.jpg,,"Developing a sales funnel is a way to put your business on a path to growth and success. From nurturing leads to closing deals, and everything in between.",https://instantly.foomonk.com/content/images/2022/05/Screenshot-2022-05-25-at-10.19.19.png,https://instantly.ai/blog/author/raul,RAUL KAEVAND,3 May 2023 •  13 min read,3 MAY 2023 
Cold Email Marketing Software To Check Out This 2023,https://instantly.ai/blog/cold-email-marketing-software,https://instantly.foomonk.com/content/images/2023/05/email-automation-software.jpg,COLD EMAIL,"If you want to choose the best cold email marketing software for your business, consider its scalability, features such as automation, and intuitive analytics. ",https://instantly.foomonk.com/content/images/2022/05/Screenshot-2022-05-25-at-10.19.19.png,https://instantly.ai/blog/author/raul,RAUL KAEVAND,3 May 2023 •  9 min read,3 MAY 2023 
8 Must-Know Types Of Email Marketing Campaigns,https://instantly.ai/blog/types-of-email-marketing,https://instantly.foomonk.com/content/images/2023/05/types-of-email.jpg,COLD EMAIL,"No matter your situation and strategy, your outreach needs to stay flexible. Here are 8 types of email marketing you need to know in 2023. ",https://instantly.foomonk.com/content/images/2022/05/Screenshot-2022-05-25-at-10.19.19.png,https://instantly.ai/blog/author/raul,RAUL KAEVAND,3 May 2023 •  5 min read,3 MAY 2023 
"How To Win With Cold Email: Definition, Strategy, Guide",https://instantly.ai/blog/cold-email,https://instantly.foomonk.com/content/images/2023/05/cold-email.jpg,COLD EMAIL,"If you think it’s time to launch a cold email campaign, make sure you’re completely clear on how to succeed. Right here is the best place to start.",https://instantly.foomonk.com/content/images/2022/05/Screenshot-2022-05-25-at-10.19.19.png,https://instantly.ai/blog/author/raul,RAUL KAEVAND,2 May 2023 •  12 min read,2 MAY 2023 
Building On Fundamentals: Crafting A Great Cold Sales Email For Any Industry,https://instantly.ai/blog/cold-sales-email,https://instantly.foomonk.com/content/images/2023/04/cold-sales-email.jpg,COLD EMAIL,The fundamentals of a great cold sales email are the same across every industry. Here are some basics and templates to build on.,https://instantly.foomonk.com/content/images/2022/05/Screenshot-2022-05-25-at-10.19.19.png,https://instantly.ai/blog/author/raul,RAUL KAEVAND,7 Apr 2023 •  9 min read,7 APR 2023 
"How To Send A Helpful, Non-Confrontational Reminder Email",https://instantly.ai/blog/reminder-email,https://instantly.foomonk.com/content/images/2023/04/reminder-emails.jpg,COLD EMAIL,"Reminder emails can be awkward to write, but you need answers. This guide will help you know when to send a reminder email and has templates to get you started.",https://instantly.foomonk.com/content/images/2022/05/Screenshot-2022-05-25-at-10.19.19.png,https://instantly.ai/blog/author/raul,RAUL KAEVAND,7 Apr 2023 •  5 min read,7 APR 2023 
Prospecting Emails: 101 + Templates,https://instantly.ai/blog/prospecting-emails,https://instantly.foomonk.com/content/images/2023/04/prospecting-emails.jpg,COLD EMAIL,Prospecting emails are essential in every sales campaign. Here are tips and best practices to help you get higher open rates in your next prospecting campaign. ,https://instantly.foomonk.com/content/images/2022/05/Screenshot-2022-05-25-at-10.19.19.png,https://instantly.ai/blog/author/raul,RAUL KAEVAND,6 Apr 2023 •  9 min read,6 APR 2023 
Build The Perfect Email Marketing Strategy Template,https://instantly.ai/blog/email-marketing-strategy-template,https://instantly.foomonk.com/content/images/2023/04/email-marketing-strategy-1.jpg,COLD EMAIL,Building your own email marketing strategy template allows you to streamline and track campaign goals more efficiently. Here’s what you need to know.,https://instantly.foomonk.com/content/images/2022/05/Screenshot-2022-05-25-at-10.19.19.png,https://instantly.ai/blog/author/raul,RAUL KAEVAND,6 Apr 2023 •  9 min read,6 APR 2023 
How To Successfully Cold Email For A Job,https://instantly.ai/blog/how-to-cold-email-for-a-job,https://instantly.foomonk.com/content/images/2023/04/how-to-cold-email-for-a-job.jpg,,"Learning how to cold email for a job is a necessary part of career progression. If you need to reach out to recruiters, this guide is for you.",https://instantly.foomonk.com/content/images/2022/05/Screenshot-2022-05-25-at-10.19.19.png,https://instantly.ai/blog/author/raul,RAUL KAEVAND,6 Apr 2023 •  7 min read,6 APR 2023 
Building An Effective Email Campaign Using The AIDA Framework,https://instantly.ai/blog/aida-framework,https://instantly.foomonk.com/content/images/2023/04/shutterstock_2239302009.jpg,COLD EMAIL,Using the AIDA framework in your email marketing campaign can help you funnel prospects into paying customers. Here’s how.,https://instantly.foomonk.com/content/images/2022/05/Screenshot-2022-05-25-at-10.19.19.png,https://instantly.ai/blog/author/raul,RAUL KAEVAND,6 Apr 2023 •  5 min read,6 APR 2023 
Are Cold Email Open Rates Worth The Buzz?,https://instantly.ai/blog/cold-email-open-rates,https://instantly.foomonk.com/content/images/2023/04/open-rates.jpg,COLD EMAIL,Cold email open rates should be monitored with other key metrics to help you make meaningful data-driven decisions. Here's how to get started. ,https://instantly.foomonk.com/content/images/2022/05/Screenshot-2022-05-25-at-10.19.19.png,https://instantly.ai/blog/author/raul,RAUL KAEVAND,4 Apr 2023 •  5 min read,4 APR 2023 
12 Email Marketing Types For Every Campaign,https://instantly.ai/blog/types-of-email,https://instantly.foomonk.com/content/images/2023/04/types-of-emails.jpg,,"Marketing evolves fast. Despite changing trends, a proven strategy like email marketing is here to stay—especially for B2B. ",https://instantly.foomonk.com/content/images/2022/05/Screenshot-2022-05-25-at-10.19.19.png,https://instantly.ai/blog/author/raul,RAUL KAEVAND,4 Apr 2023 •  8 min read,4 APR 2023 
An Evergreen Email Outreach Guide From Instantly,https://instantly.ai/blog/email-outreach,https://instantly.foomonk.com/content/images/2023/04/email-outreach.jpg,COLD EMAIL,Unlock the true potential of email outreach. ,https://instantly.foomonk.com/content/images/2022/05/Screenshot-2022-05-25-at-10.19.19.png,https://instantly.ai/blog/author/raul,RAUL KAEVAND,3 Apr 2023 •  13 min read,3 APR 2023 
The 10 Best Cold Email Templates For Improving Your Response Rate,https://instantly.ai/blog/cold-email-templates,https://instantly.foomonk.com/content/images/2023/04/cold-email-templates--2-.jpg,COLD EMAIL,Need to start email outreach but aren’t sure where to begin? These cold email templates will get you underway and you’ll soon see responses flooding your inbox.,https://instantly.foomonk.com/content/images/2022/05/Screenshot-2022-05-25-at-10.19.19.png,https://instantly.ai/blog/author/raul,RAUL KAEVAND,3 Apr 2023 •  14 min read,3 APR 2023 
Unlocking Success: Email Marketing Strategy for B2B,https://instantly.ai/blog/email-marketing-strategy-for-b2b,https://instantly.foomonk.com/content/images/2023/04/email-marketing-strategy.jpg,COLD EMAIL,"An effective email marketing strategy for B2B includes personalization, email warm-ups, segmentation, and relevant content for specific people in a company. ",https://instantly.foomonk.com/content/images/2022/05/Screenshot-2022-05-25-at-10.19.19.png,https://instantly.ai/blog/author/raul,RAUL KAEVAND,3 Apr 2023 •  6 min read,3 APR 2023 
Winning Copywriting Formulas For Converting Emails,https://instantly.ai/blog/copywriting-formulas,https://instantly.foomonk.com/content/images/2023/03/copywriting-formula.jpg,COLD EMAIL,Emails can be a powerful tool to give the final push towards conversion. Learn about the copywriting formulas needed to write effective conversion emails.,https://instantly.foomonk.com/content/images/2022/05/Screenshot-2022-05-25-at-10.19.19.png,https://instantly.ai/blog/author/raul,RAUL KAEVAND,28 Mar 2023 •  6 min read,28 MAR 2023 
The 15 Best Sales Email Subject Lines That Get Responses,https://instantly.ai/blog/sales-email-subject-lines,https://instantly.foomonk.com/content/images/2023/03/sales-email-subject-lines.jpg,COLD EMAIL,"Keen to get your emails noticed and responded to you? You need to nail everything, especially your sales email subject lines. We share top tips and examples.",https://instantly.foomonk.com/content/images/2022/05/Screenshot-2022-05-25-at-10.19.19.png,https://instantly.ai/blog/author/raul,RAUL KAEVAND,2 Mar 2023 •  7 min read,2 MAR 2023 
Using Merge Tags to Effectively Personalize Emails,https://instantly.ai/blog/merge-tags,https://instantly.foomonk.com/content/images/2023/02/shutterstock_1839063148.jpg,COLD EMAIL,"Let us, here at Instantly, help you save time, increase efficiency, and boost your email engagement, all with merge tags. Personalization made simple",https://instantly.foomonk.com/content/images/2022/05/Screenshot-2022-05-25-at-10.19.19.png,https://instantly.ai/blog/author/raul,RAUL KAEVAND,28 Feb 2023 •  3 min read,28 FEB 2023 
Learn How to Increase Online Sales Through Effective Cold Email Outreach,https://instantly.ai/blog/how-to-increase-online-sales,https://instantly.foomonk.com/content/images/2023/02/-how-to-increase-online-sales.jpg,COLD EMAIL,"Need to find out how to increase online sales for your business? Cold email outreach is going to be a great solution, and these steps will unlock its potential.",https://instantly.foomonk.com/content/images/2022/05/Screenshot-2022-05-25-at-10.19.19.png,https://instantly.ai/blog/author/raul,RAUL KAEVAND,28 Feb 2023 •  5 min read,28 FEB 2023 
Effective Email Outreach: 7 Proven Email Design Best Practices,https://instantly.ai/blog/email-design-best-practices,https://instantly.foomonk.com/content/images/2023/02/email-design-best-practices-1.jpg,COLD EMAIL,"If you’re about to launch a new email campaign, or even if you’re planning one, these 7 email design best practices aren’t to be missed. ",https://instantly.foomonk.com/content/images/2022/05/Screenshot-2022-05-25-at-10.19.19.png,https://instantly.ai/blog/author/raul,RAUL KAEVAND,28 Feb 2023 •  6 min read,28 FEB 2023 
Understanding Sales Funnel Stages: What You Need To Know,https://instantly.ai/blog/sales-funnel-stages,https://instantly.foomonk.com/content/images/2023/02/sales-funnel-stages.jpg,,Knowing how to sell and handle objections from any customer that comes your way is a superpower in the world of sales. Understanding the stages of a sales funnel is key to doing just that.,https://instantly.foomonk.com/content/images/2022/05/Screenshot-2022-05-25-at-10.19.19.png,https://instantly.ai/blog/author/raul,RAUL KAEVAND,28 Feb 2023 •  5 min read,28 FEB 2023 
Using Targeted Email Marketing To Create Better Relationships,https://instantly.ai/blog/targeted-email-marketing,https://instantly.foomonk.com/content/images/2023/02/targeted-email-marketing.jpg,COLD EMAIL,"Standard one-size-fits-all email marketing is dead. Targeted email marketing is the new king. Greater ROI, happier customers, and more relevant marketing.",https://instantly.foomonk.com/content/images/2022/05/Screenshot-2022-05-25-at-10.19.19.png,https://instantly.ai/blog/author/raul,RAUL KAEVAND,27 Feb 2023 •  5 min read,27 FEB 2023 
Maximizing Conversions Through Sales Email Best Practices,https://instantly.ai/blog/sales-email-best-practices,https://instantly.foomonk.com/content/images/2023/02/sales-emails-best-practices.jpg,COLD EMAIL,Adhering to these sales email best practices will deliver the best possible results for your sales email campaign. Miss these and you’ll regret it.,https://instantly.foomonk.com/content/images/2022/05/Screenshot-2022-05-25-at-10.19.19.png,https://instantly.ai/blog/author/raul,RAUL KAEVAND,27 Feb 2023 •  7 min read,27 FEB 2023 
Effective Strategies for Creating Email Lists for Marketing Campaigns,https://instantly.ai/blog/email-lists-for-marketing,https://instantly.foomonk.com/content/images/2023/02/email-lists-for-marketing.png,COLD EMAIL,Discover how to create and use effective strategies to develop email lists for marketing purposes in order to reach your target audience and drive sales,https://instantly.foomonk.com/content/images/2022/05/Screenshot-2022-05-25-at-10.19.19.png,https://instantly.ai/blog/author/raul,RAUL KAEVAND,27 Feb 2023 •  8 min read,27 FEB 2023 
Steal These 12 Email Marketing Templates For Your Campaigns in 2023,https://instantly.ai/blog/email-marketing-templates,https://instantly.foomonk.com/content/images/2023/02/templates-for-email-marketing.jpg,COLD EMAIL,Email marketing can be a hit or miss. Some marketers might say it’s a dated strategy. But it holds a couple of advantages that helped it stand the test of time. The challenge is making compelling and personalized emails worth opening.,https://instantly.foomonk.com/content/images/2022/05/Screenshot-2022-05-25-at-10.19.19.png,https://instantly.ai/blog/author/raul,RAUL KAEVAND,27 Feb 2023 •  8 min read,27 FEB 2023 
Settling The HTML vs. Plain Text Email Debate,https://instantly.ai/blog/html-vs-plain-text,https://instantly.foomonk.com/content/images/2023/02/html-vs-plain-text.png,COLD EMAIL,You don’t have to pick a side in the HTML vs Plain text email fight. It turns out there’s a time and a place for both email types.,https://instantly.foomonk.com/content/images/2022/05/Screenshot-2022-05-25-at-10.19.19.png,https://instantly.ai/blog/author/raul,RAUL KAEVAND,27 Feb 2023 •  4 min read,27 FEB 2023 
Supercharging Your B2B Lead Generation Strategy With Email,https://instantly.ai/blog/b2b-lead-generation-strategy,https://instantly.foomonk.com/content/images/2023/02/lead-generation-strategy-b2b.jpg,COLD EMAIL,"Developing a successful B2B lead generation strategy should 100% include email. This scalable, affordable, personal method can’t be missed.",https://instantly.foomonk.com/content/images/2022/05/Screenshot-2022-05-25-at-10.19.19.png,https://instantly.ai/blog/author/raul,RAUL KAEVAND,27 Feb 2023 •  5 min read,27 FEB 2023 
The 9 Best Cold Email Software Available In 2023,https://instantly.ai/blog/cold-email-software,https://instantly.foomonk.com/content/images/2023/02/cold-email-software.jpg,COLD EMAIL,Finding the right cold email software that’s the right fit for your business is tough. That’s why we’ve put together this guide and are sharing our top picks.,https://instantly.foomonk.com/content/images/2022/05/Screenshot-2022-05-25-at-10.19.19.png,https://instantly.ai/blog/author/raul,RAUL KAEVAND,27 Feb 2023 •  13 min read,27 FEB 2023 
What is DMARC and How Can It Protect Your Business?,https://instantly.ai/blog/dmarc,https://instantly.foomonk.com/content/images/2023/02/DMARC.jpg,,"96% of phishing attacks occur through emails, making email security a top priority for businesses. DMARC is one of the most important tools to help protect your digital assets and reputation from cyber threat actors.",https://instantly.foomonk.com/content/images/2022/05/Screenshot-2022-05-25-at-10.19.19.png,https://instantly.ai/blog/author/raul,RAUL KAEVAND,2 Feb 2023 •  4 min read,2 FEB 2023 
5 Ways to Generate Warm Leads Like a Pro,https://instantly.ai/blog/warm-leads,https://instantly.foomonk.com/content/images/2023/02/warm-lead.jpg,,"Warm leads are a key part of sales that help drive leads to you rather than vice versa. Knowing how to generate warm leads will save you time, money, and effort and help you set up a system that keeps leads coming to you.",https://instantly.foomonk.com/content/images/2022/05/Screenshot-2022-05-25-at-10.19.19.png,https://instantly.ai/blog/author/raul,RAUL KAEVAND,2 Feb 2023 •  5 min read,2 FEB 2023 
Unlocking the Power of Marketing Agency Lead Generation: 6 Channels to Use,https://instantly.ai/blog/marketing-agency-lead-generation,https://instantly.foomonk.com/content/images/2023/02/lead-generation-for-marketing-agencies.jpg,,Keen to scale to the next level? Harness the power of these multiple channels if you want to grow and scale your marketing agency lead generation strategies. ,https://instantly.foomonk.com/content/images/2022/05/Screenshot-2022-05-25-at-10.19.19.png,https://instantly.ai/blog/author/raul,RAUL KAEVAND,2 Feb 2023 •  4 min read,2 FEB 2023 
SPF Records Explained: Why It’s Crucial for Business Emails,https://instantly.ai/blog/spf-records,https://instantly.foomonk.com/content/images/2023/02/spf-records.jpg,,SPF records are an essential security measure businesses use to ensure that their emails are authenticated and sent from legitimate sources. We've got you covered if you want to use SPF records to enhance your business’s email security.,https://instantly.foomonk.com/content/images/2022/05/Screenshot-2022-05-25-at-10.19.19.png,https://instantly.ai/blog/author/raul,RAUL KAEVAND,2 Feb 2023 •  4 min read,2 FEB 2023 
How To Supercharge Your Sales Outreach With Automation,https://instantly.ai/blog/sales-outreach,https://instantly.foomonk.com/content/images/2023/02/sales-outreach.jpg,,"Manually reaching out to potential customers takes up valuable resources that could be put toward other tasks. Fortunately, automation technology can help you supercharge your sales outreach efforts in no time - and with minimal effort.",https://instantly.foomonk.com/content/images/2022/05/Screenshot-2022-05-25-at-10.19.19.png,https://instantly.ai/blog/author/raul,RAUL KAEVAND,2 Feb 2023 •  4 min read,2 FEB 2023 
5 Sales Break-Up Emails And When to Use Them,https://instantly.ai/blog/break-up-emails,https://instantly.foomonk.com/content/images/2023/02/breakup-emails.jpg,,What do you do when your prospect doesn’t respond to your emails? Writing a sales break-up email is an effective way of following up with those prospects that have gone cold and allowing them to reconnect.,https://instantly.foomonk.com/content/images/2022/05/Screenshot-2022-05-25-at-10.19.19.png,https://instantly.ai/blog/author/raul,RAUL KAEVAND,1 Feb 2023 •  4 min read,1 FEB 2023 
Recruiting Email Templates You Can Use For Your Next Hire,https://instantly.ai/blog/recruiting-email-templates,https://instantly.foomonk.com/content/images/2023/02/recruitment-email-template.jpg,,"Some simple steps you can take will help speed up the process and ensure you don't miss any potential hires along the way–starting with recruitment emails. So if you're looking to fill a position quickly and efficiently, using well-crafted recruiting emails is worth considering.",https://instantly.foomonk.com/content/images/2022/05/Screenshot-2022-05-25-at-10.19.19.png,https://instantly.ai/blog/author/raul,RAUL KAEVAND,1 Feb 2023 •  6 min read,1 FEB 2023 
7 Tried & Tested Cold Email Marketing Examples You Can Steal,https://instantly.ai/blog/cold-email-marketing-examples,https://instantly.foomonk.com/content/images/2023/02/cold-email-marketing-examples.jpg,,Cold email marketing technique is honed over a long period of time by professionals who have become masters of the art. It involves incredible psychological understanding to get inside the prospect’s mind. ,https://instantly.foomonk.com/content/images/2022/05/Screenshot-2022-05-25-at-10.19.19.png,https://instantly.ai/blog/author/raul,RAUL KAEVAND,1 Feb 2023 •  6 min read,1 FEB 2023 
Leveraging Automation for Effective Nurture Email Campaigns,https://instantly.ai/blog/nurture-email-campaigns,https://instantly.foomonk.com/content/images/2023/02/nurture-email-campaigns.jpg,,People are used to receiving a ton of emails every day. But what if you could use emails to build meaningful relationships with prospects and keep current customers coming back for more? Read on because that’s where nurture email campaigns come in.,https://instantly.foomonk.com/content/images/2022/05/Screenshot-2022-05-25-at-10.19.19.png,https://instantly.ai/blog/author/raul,RAUL KAEVAND,1 Feb 2023 •  7 min read,1 FEB 2023 
5 Effective Email Response Examples You Can Steal,https://instantly.ai/blog/email-response-examples,https://instantly.foomonk.com/content/images/2023/02/email-response.jpg,,"When it comes to writing effective emails, there are many different strategies and techniques that can be employed. Whether responding to a customer query or following up on a project, an effective response is essential.",https://instantly.foomonk.com/content/images/2022/05/Screenshot-2022-05-25-at-10.19.19.png,https://instantly.ai/blog/author/raul,RAUL KAEVAND,1 Feb 2023 •  5 min read,1 FEB 2023 
Intro to Customer Relations: What Is Customer Engagement?,https://instantly.ai/blog/customer-engagement-meaning,https://instantly.foomonk.com/content/images/2023/02/what-is-customer-engagement.jpg,,"When it comes to improving customer relations, many still think it is about providing high-quality service and support. But the truth is that customer engagement goes beyond simply providing help. That is because your customer's mindset has now changed.",https://instantly.foomonk.com/content/images/2022/05/Screenshot-2022-05-25-at-10.19.19.png,https://instantly.ai/blog/author/raul,RAUL KAEVAND,1 Feb 2023 •  3 min read,1 FEB 2023 
8 Best Email Tester & Validation Tools for Your Campaigns,https://instantly.ai/blog/email-tester,https://instantly.foomonk.com/content/images/2023/02/email-tester.jpg,,"Are you looking for the best email tester and validation tools to improve your campaigns? Email marketing is one of the most powerful ways to reach customers. 59% of marketers say email is their biggest source of ROI, and 87% use email marketing to disseminate their content.",https://instantly.foomonk.com/content/images/2022/05/Screenshot-2022-05-25-at-10.19.19.png,https://instantly.ai/blog/author/raul,RAUL KAEVAND,1 Feb 2023 •  6 min read,1 FEB 2023 
Powerful Cold Email Templates for B2B Sales Outreach,https://instantly.ai/blog/cold-email-templates-for-b2b,https://instantly.foomonk.com/content/images/2023/02/cold-email-templates.jpg,,Cold emailing is an indispensable tool for B2B sales teams looking to expand their reach. You can easily make your cold outreach stand out from the competition with the right strategy and crafty copywriting. ,https://instantly.foomonk.com/content/images/2022/05/Screenshot-2022-05-25-at-10.19.19.png,https://instantly.ai/blog/author/raul,RAUL KAEVAND,1 Feb 2023 •  5 min read,1 FEB 2023 
What Are DKIM Records and Why Do You Need Them?,https://instantly.ai/blog/dkim-records,https://instantly.foomonk.com/content/images/2023/02/dkim-records.jpg,,DKIM records are an important part of email authentication. Find out what DKIM records are and how to set them up to protect your email and sender reputation.,https://instantly.foomonk.com/content/images/2022/05/Screenshot-2022-05-25-at-10.19.19.png,https://instantly.ai/blog/author/raul,RAUL KAEVAND,1 Feb 2023 •  4 min read,1 FEB 2023 
